id	created_at	full_text
1513156496456130564	2022-04-10 14:06:36+00:00	Joined the Taoiseach and members of Fianna Fáil at Arbour Hill this afternoon for our annual Easter 1916 Commemoration. It was wonderful to catch up with so many members and supporters from across the country. https://t.co/43Es8pzkIN
1512416801912766467	2022-04-08 13:07:19+00:00	I’m looking forward to attending @monkstowndrama tomorrow night - tickets are still available from @HewettNewsagent https://t.co/hivLBms3Iq
1511633171594502144	2022-04-06 09:13:27+00:00	Ukrainian President Volodymyr Zelenskyy addressing a special joint sitting of the Oireachtas. Mr Zelenskyy thanks Ireland for our support. Tells TDs and Senators that Russia continues to bomb Ukraine 24/7, war crimes and other atrocities are still being committed. 🇮🇪🇺🇦 https://t.co/qBluzLQkR4
1510677164978544649	2022-04-03 17:54:37+00:00	Congratulations to @BlackrockColl on winning the 70th Leinster Schools Senior Cup at the RDS this afternoon. Hard luck to @Gonzagadublin, I'm sure they will be back next year. #GONvBLA https://t.co/S9fkH1LLqq
1510294998171979781	2022-04-02 16:36:02+00:00	What a shot @defenceforces! 📷 Wishing all of those on our waters safe and happy times during the months ahead. https://t.co/BaT4aqBPjN
1510252795127074817	2022-04-02 13:48:20+00:00	@osullivankw @dlrls @royalmarine @FitzCastle @ucddublin @IENewparkSchool @fiannafailparty Swimming is the second most popular sport amongst adults, about 300,000 adults participate each week, many using hotel facilities open to the public. This is recognised in the grant support, the aim being to encourage swimming by supporting a national network of swimming pools
1509208523216928777	2022-03-30 16:38:46+00:00	@Merriganmania Hi Graham, a positive antigens if administered through pharmacy or private test centre can be linked to the Covid Cert, but home ones can't afaik
1509207196307005440	2022-03-30 16:33:29+00:00	@lauriemannix Hi Laurie, I know, it's a shame it's been closed so long. I understand the Council are developing a plan for the facility, but elected reps from the Stillorgan side of the county / Rathdown might know more.
1509201058240905223	2022-03-30 16:09:06+00:00	Great news today, almost €100,000 has been allocated to support local swimming pools in Dún Laoghaire.   DLR Leisure will get over €30,000 to support operations at Loughlinstown &amp; Monkstown. Pools at UCD, Fitzpatrick's Castle, the Royal Marine &amp; Newpark School are also included https://t.co/PwFoj2HkIK
1508869347342794755	2022-03-29 18:11:00+00:00	@ciarandonohoe @JustinMoylan Hi Ciaran, just to let you know the Council confirmed that the Litter Warden engaged with outlets in the area today to remind them of their obligations, hopefully we will see an improvement.
1507787460360691721	2022-03-26 18:31:58+00:00	Congratulations to all of the recipients and those nominated at the #IrishSailingAwards2021 @royalmarine today. The #ISA President’s Award went to @Annalise_Murphy while Finn Lynch was recognised as Sailor of the Year 👏🏻👏🏻👏🏻 https://t.co/5lkMlpeC4c https://t.co/Az2a0Nub3I
1507435257980764166	2022-03-25 19:12:26+00:00	Great to join Jack Marley from Monkstown Boxing Club - Jack just won a Gold Medal for Ireland at the European U-22 Boxing Championships in Croatia.   Fantastic to be at Joey's in Sallynoggin with Cllr Justin Moylan and everyone from @MONKSTOWNBC to celebrate the achievement 🥊🇮🇪 https://t.co/kQOW4ShiDP
1507407249773592578	2022-03-25 17:21:09+00:00	@Batdoyle @ciarandonohoe @dominos @dlrcc I know Mark, between excessive poles and litter the public realm lets us down across Dublin, it's something I've raised since elected, will keep on it.
1507406708154548235	2022-03-25 17:19:00+00:00	@ciarandonohoe @JustinMoylan Hi Ciaran, just to let you know the Council replied today, they are going to investigate and take appropriate action. If you DM me an email, I'll forward any updates.
1507403423842451467	2022-03-25 17:05:57+00:00	Raised the Pandemic Bonus for Frontline Healthcare Workers in the #Dáil - the process and payment must be fair and recognise the efforts of part-time workers. https://t.co/adprt1FIRn
1507017140758474769	2022-03-24 15:31:00+00:00	🌼 My pooch and I getting ready to support the @IrishCancerSoc fundraiser tomorrow (Friday 25th) #DaffodilDay   If you’re unable to attend an event but would like to contribute, you can do so online https://t.co/Di0YcOecnV 🌼 🐾 https://t.co/7jXYQApUJ4
1507006090487078914	2022-03-24 14:47:05+00:00	@ciarandonohoe Thanks Ciaran, I'll raise it with @JustinMoylan asking for it to be sorted out
1506700780304318464	2022-03-23 18:33:53+00:00	Great to welcome so many members of @OgraFiannaFail to Leinster House this evening https://t.co/02VqnJSsw0
1506690943486943234	2022-03-23 17:54:48+00:00	School secretaries have voted in favour of accepting the @Education_Ire offer of improved pay and conditions.  Secretaries are an integral part of our school communities and this is further recognition of the work they do. https://t.co/nMFDFOn6ts
1504848579952848900	2022-03-18 15:53:54+00:00	Meeting with the Chair of the Lithuanian Committee on National Security and Defence, Laurynas Kasčiūnas, before visiting the Lithuanian border for a briefing on the current situation. https://t.co/gpnRy1JLzV
1504786130214006786	2022-03-18 11:45:45+00:00	Ireland's Ambassador to Lithuania Peter Mc Ivor read series of very poignant poems by Seamus Heaney that captured the mood this #StPatricksDay #LáFhéilePádraig #ŠvPatrikoDiena https://t.co/Qrsl6KxjeL
1504784406480928768	2022-03-18 11:38:54+00:00	Honoured to join members of the Lithuanian Parliament, the Seimas, at an official event marking #StPatricksDay and the close relationship between Ireland and Lithuania #LáFhéilePádraig #ŠvPatrikoDiena 🇮🇪🇱🇹 https://t.co/swYA76OpUg
1504758239656923143	2022-03-18 09:54:56+00:00	Early start in #Vilnius today as part of #StPatricksDay visit, meeting with Lithuanian Vice Minister for Foreign Affairs Egidijus Meilūnas &amp; the Vice Minister for Defence Žilvinas Tomkus to discuss the the war in Ukraine &amp; Irish-Lithuanian relations #ŠvPatrikoDiena 🇮🇪🇱🇹 https://t.co/uw8Z009mbK
1504477946634915848	2022-03-17 15:21:08+00:00	Happy #LáFhéilePádraig to everyone at home &amp; abroad.   Visiting Lithuania this year at the invitation of the Lithuanian Parliament / #Seimas to mark #StPatricksDay.   Great to meet so many members of the Irish-Lithuanian Inter-Parliamentary Group. #ŠvPatrikoDiena 🇮🇪🇱🇹 https://t.co/1KszRkH3WT
1504107653219426307	2022-03-16 14:49:44+00:00	Wonderful to join students from Blackrock Educate Together Secondary School at the Dáil today to protest the invasion of Ukraine. They walked from Blackrock to the Dáil to raise funds to support Ukrainians who have had to come to Ireland.  Well done to all the students 👏🇮🇪🇺🇦 https://t.co/3v7o2YP25A
1503308530303922180	2022-03-14 09:54:18+00:00	The €125 Fuel Allowance payment will be paid to 372,000 households from today. This is in addition to the €200 energy credit which will be paid in April. https://t.co/8Nw4tCYR0x
1501670028189618180	2022-03-09 21:23:29+00:00	Speaking on the proposed emergency changes to reduce the cost of petrol and diesel. Authorities must investigate reports of price gouging and profiteering and take action against those companies. https://t.co/QT1koQu7zg
1501611570673160197	2022-03-09 17:31:11+00:00	Raised the crisis in respite care for people with an intellectual disability living in Dún Laoghaire, South Dublin and North Wicklow in the Dáil. We need an urgent intervention to restore respite services https://t.co/5GlJRMGVEJ
1501587477924098054	2022-03-09 15:55:27+00:00	Sorry to hear this Paul - glad you’re okay. Any help from anyone in the #Deansgrange area today would be nice. https://t.co/OVcqRxIS8q
1501204971357937665	2022-03-08 14:35:30+00:00	Thank you and well done to Senator @Fiona_Kildare and @alzheimersocirl for organising a briefing for all Oireachtas members on Brain Health &amp; Dementia today. https://t.co/aF66cNkCfP
1500093911108313095	2022-03-05 13:00:33+00:00	Out and about in Glenageary this morning meeting residents to discuss local and national issues. Great day for it https://t.co/JtYvDP045K
1499735993997574147	2022-03-04 13:18:19+00:00	@paulykinsella @dlrcommunity Best of luck, it's great to see trips and training camps back
1499734284470472705	2022-03-04 13:11:31+00:00	Joined students at CBC Monkstown for their protest against Russia's invasion of Ukraine   You can support Ukraine by donating to NGOs (including the Red Cross)⤵️ https://t.co/HSU95wVMBW  You can also donate directly to Ukraine, via their embassy in Ireland https://t.co/P22Fry1YtZ https://t.co/h3TP97KRjt
1499302007768862720	2022-03-03 08:33:48+00:00	@CBCMonkstownpk Well done all, I look forward to standing with you tomorrow morning 🇮🇪🇺🇦
1499195372354289668	2022-03-03 01:30:05+00:00	Dáil Éireann has unanimously passed a motion condemning Russia's invasion of #Ukraine   Earlier we met with Ukrainian Ambassador to Ireland Larysa Gerasko who joined the Fianna Fáil Parliamentary Party meeting to give us an update on the war &amp; the suffering being caused by Russia https://t.co/fX4ibZNXAM
1498578548331888642	2022-03-01 08:39:02+00:00	Well done to the students &amp; staff of @CBCMonkstownpk #StandingWithUkriane 👏🏻👏🏻 🇮🇪🇺🇦 https://t.co/tczBhCs9sV
1497303773009559562	2022-02-25 20:13:32+00:00	@EddieMu87 Hi Eddie, it applies to all Ukrainians travelling to Ireland
1497225202232709120	2022-02-25 15:01:19+00:00	🚨 #Ireland has lifted visa requirements for Ukrainians.   It will apply as an emergency measure to all Ukrainians travelling to Ireland and takes effect immediately.   All EU states should do the same.   More info: https://t.co/SY0iwhdAuT https://t.co/2kog0WRD7e
1496886494254202881	2022-02-24 16:35:25+00:00	Joined members of the Irish-Ukrainian community at the Dáil this afternoon, they are extremely worried about the safety of their family and friends in #Ukraine.  Earlier, I called on the government to introduce a visa waiver to allow Ukrainians join family here in Ireland https://t.co/EXS9RzKehx
1496712079721566209	2022-02-24 05:02:22+00:00	@tconnellyRTE @rtenews Stay safe Tony
1496192549874249729	2022-02-22 18:37:56+00:00	Fantastic to join Minister James Browne and Cllr Michael Clark at Loughlinstown Community Rooms today to see the wonderful work being done by the local Youth Diversion Project https://t.co/3UWjlj9x5Q
1496148371656122376	2022-02-22 15:42:23+00:00	All Irish residents will be eligible to participate. Recognising issues with pervious assemblies, a new format will be used to select participants 14,000 homes in Dublin &amp; 20,000 nationwide will be randomly selected and receive an invitation to join a panel for selection.
1496147453388722190	2022-02-22 15:38:44+00:00	Minister Jack Chambers in the Dáil detailing the composition of the Citizens' Assemblies  🏦Dublin Assembly will comprise 80 members: chair, 12 cllrs &amp; 67 members (randomly selected from 14,000 people)  🌍Biodiversity Assembly: chair &amp; 99 members (r/selected from 20,000 people) https://t.co/f5SiajjwcP
1496144219085414409	2022-02-22 15:25:53+00:00	Minister Jack Chambers tells the Dáil that households will have the opportunity to include a time capsule message with their #Census2022 return.   The message will be sealed for 100 years until 2122 when it will be published for future generations. https://t.co/ECn95Lf6np
1494434306680307717	2022-02-17 22:11:18+00:00	@NewparkMusic @theirishecho @grace_tallon @IrishEcho @culture_ireland @IrishTimesCultr @RTE_Culture @RTEArena @DeptCulturelRL The best of luck Grace 🤞🏻
1494434037917753348	2022-02-17 22:10:14+00:00	This funding is much needed and long overdue. I hope to see significant progress being made for the children who require urgent and necessary orthopaedic surgery (many of whom have been left waiting for far too long). https://t.co/B4JBnESsaQ
1494433434391003142	2022-02-17 22:07:50+00:00	Well said Mary @votemaryfitz 👏🏻 https://t.co/cjhIVE0bfV
1494232421516128257	2022-02-17 08:49:05+00:00	This seems a positive development and I look forward to further progress being made for these children https://t.co/a0B31o0kHk
1494231242404999171	2022-02-17 08:44:24+00:00	Exiting plans for St Laurence’s College #Loughlinstown - looking forward to seeing this project https://t.co/S54Cy7YDhO
1494012792852123649	2022-02-16 18:16:21+00:00	Raised the need to confirm arrangements for customers using Prepaid Meters when the €200 Household Electricity Credit is issued. We need to see credits issued that customers can use right away in their meter. @fiannafailparty @AgeAction @SVP_Ireland @SparkIreland @SocialJusticeI https://t.co/st7Kq9M2xW
1493698843296288770	2022-02-15 21:28:50+00:00	Great to welcome @fiannafailparty councillors from across Dublin to Leinster House for a meeting with our Parliamentary Group on Dublin. https://t.co/d4oSnZ5H7D
1492462133254184961	2022-02-12 11:34:35+00:00	Great store, great service, great value in Dún Laoghaire. #ShopLocal ⤵️ https://t.co/oxxqh6m9fO
1492461140290514948	2022-02-12 11:30:39+00:00	@TomClonan Best of luck Tom! 👍
1492258551582146561	2022-02-11 22:05:38+00:00	Well done and thank you to Minister @jackfchambers for all of his time and support for the record level of funding for clubs and organisations across the greater #Dublin region. https://t.co/PNUhNMwbME
1492110824323915779	2022-02-11 12:18:37+00:00	Great to see so many local clubs &amp; organisations in Dún Laoghaire benefit from the sports grants  Well done to @dlrcc officials for working with clubs to submit applications - over €1 million has been allocated to DLR projects including Kilbogget, Hudson &amp; Shanganagh parks 👍 https://t.co/jGCvREtbaM
1492106569521184770	2022-02-11 12:01:42+00:00	Fantastic to see record sports funding announced, almost €3 million has been allocated to sports clubs in Dún Laoghaire Rathdown, including €352,300 to upgrade DLR facilities at Kilbogget Park &amp; €150,000 for Monkstown Boxing Club. Thanks to Minister Jack Chambers for support👍 https://t.co/6nI1jLBohy
1491853557762609152	2022-02-10 19:16:20+00:00	📢 The Household Electricity Credit will be increased to €200 for every home as part of a package of measures to help families deal with the cost of energy.  Other measures include 20% cut in all public transport fares from April &amp; €125 lump sum payment added to Fuel Allowance https://t.co/wWYuC7TinV
1491792793924030470	2022-02-10 15:14:52+00:00	Raised the need to reduce waiting lists for children who need spinal surgery, highlighting the case of Cara who was on @IrelandAMVMTV Monday with her parents Tanya &amp; Colin to share their story &amp; the impact it's having children with Spina Bifida #páistíinpain @SBH_PAG @CappaghKids https://t.co/q8bqVfcqpt
1491741311732490241	2022-02-10 11:50:18+00:00	Two Citizens' Assemblies were announced this week   A Biodiversity Citizens' Assembly will examine how the State can improve its response to the #BiodiversityCrisis  The Dublin Citizens' Assembly will consider the type of directly elected mayor &amp; structures best suited for Dublin https://t.co/RRGLM5dojT
1491673929840222213	2022-02-10 07:22:33+00:00	@aarondalydub @64_Wine @dlrcc Hi Aaron, thanks for letting me know. I’ll ask my colleague and local councillor for the area, @JustinMoylan to raise this at the Council for you. You might dm your details to us please? Thanks
1491673112278183936	2022-02-10 07:19:18+00:00	@64_Wine @dlrcc @AnthonyRobineau @mitchellandson @RococoIreland @cavistons @SoulWomanShoes @RasamRestaurant @fitzsandycove Gerard, I’ll work with our local cllr @JustinMoylan on this and revert.
1491156012711444482	2022-02-08 21:04:32+00:00	New retrofitting scheme has been launched - lots of options to improve the energy efficiency of homes, with very significant grants. One-stop-shops will be established to access the scheme. Learn more at https://t.co/Rrf4yrbNwa https://t.co/9cFIpQNWKY
1491153907229233156	2022-02-08 20:56:10+00:00	@kryan4 @fiannafailparty Fair points Kevin, that's what why I suggested the trial, the new 90-minute journey fare would be perfect to try it out as people have to tag on with their Leap card so stats could be measured etc, but they should do something for intercity commuters too.
1491147666700455940	2022-02-08 20:31:22+00:00	Free or discounted public transport options should be considered as part of the government's package to cushion households from the impact of inflation. Asked the Taoiseach to consider free or discounted 90-min fares across #DART, #Luas &amp; bus services in #Dublin. @fiannafailparty https://t.co/T228jb1wWX
1490695783808704520	2022-02-07 14:35:45+00:00	Dalkey Island looking well in the fine spring weather  The island is closed to visitors until the 28th February to facilitate the management of rodents which threaten birds, particularly the tern colony during nesting season  Looking forward to visiting the island when it reopens https://t.co/SyhNq0GgM8
1490636477000306688	2022-02-07 10:40:05+00:00	Great to join students and the school community at Holy Child Sallynoggin to discuss new pathways to third level and higher education options with Minister Simon Harris. https://t.co/PLMY2q6gHl
1489968052523479040	2022-02-05 14:24:00+00:00	Wonderful to see a full house at Landsdown Road again. Great start. C'mon Ireland 🇮🇪 #IREvWAL #IrishRugby #SixNations https://t.co/hCaTdqlDKH
1488976713510006786	2022-02-02 20:44:47+00:00	Saddened to learn about the death of Noel Treacy, former @fiannafailparty TD for Galway East. He made a significant contribution to public life as a TD, minister and Cathaoirleach of Galway GAA.   My condolence to his wife Mary, his family and friends. Ar dheis Dé go raibh a anam https://t.co/PD7rFzdMAA
1487391223685996546	2022-01-29 11:44:36+00:00	What a photo! Welcome back Richard. Absolutely thrilled to see you back on home on Irish soil with Tara and your children. Enjoy the special time ahead… https://t.co/btKLItsere
1487157702916718601	2022-01-28 20:16:41+00:00	@DublinCommuters @Sam_Fitzgerald7 Support for improvements for fares and integrated ticketing  https://t.co/JTzZbPEQ48
1487157519491420165	2022-01-28 20:15:57+00:00	@DublinCommuters @Sam_Fitzgerald7 Tackling anti-social behaviour on public transport https://t.co/mQo46KOwex
1487157219032547334	2022-01-28 20:14:45+00:00	@DublinCommuters @Sam_Fitzgerald7 Issues with #Metrolink https://t.co/Y4DGfCGrTt
1487157092142272513	2022-01-28 20:14:15+00:00	@DublinCommuters @Sam_Fitzgerald7 In the past 6 months alone I've raised public transport more than half a dozen times. Including Nitelink resuming: https://t.co/ayW8SprRad
1487154728459030535	2022-01-28 20:04:51+00:00	@DublinCommuters @Sam_Fitzgerald7 Thanks for your feedback @DublinCommuters and Sam. I've a long track record of campaigning for improvements to Luas, Bus and Dart services in Dublin.
1487056971240984584	2022-01-28 13:36:24+00:00	Wonderful news for Richard O'Halloran and the O'Halloran family. It has been a very long three years for them.   Thank you to everyone involved in resolving this terrible situation. https://t.co/4ISdZNzaGA
1486807745672196105	2022-01-27 21:06:04+00:00	Raised concerns about service levels on a number of bus routes in Dublin with NTA officials at the Public Accounts Committee - including issues with 63, 17, 75 and 175 services and the need to adjust the schedules of the 111 and 59 to better serve local schools in Dún Laoghaire. https://t.co/qkcs0AfKiN
1486652310541508611	2022-01-27 10:48:26+00:00	I raised the conflict on bus time tables for educational facilities as well as cancellation / delays on certain bus routes 17, 59, 63, 75, 75A &amp; 111 with the #NTA at the Public Accounts Committee. If you’re experiencing difficulties visit https://t.co/ghG4Nqq30F #publictransport https://t.co/nvpNuwXP8P
1486059120306368515	2022-01-25 19:31:18+00:00	Raised the humanitarian crisis in #Tonga with the Tánaiste @LeoVaradkar last week - almost 85,000 people are struggling following the volcanic eruption &amp; tsunami.   Good to see Minister Colm Brophy @brophytalks allocate €250k in emergency funding today to support aid efforts👍 https://t.co/smwoYn7xIy
1486035478390480904	2022-01-25 17:57:21+00:00	Nuacht iontach do phobal na scoile i gColáiste Eoin, Booterstown - Minister Norma Foley has advised me that the school will be allocated funding under the Additional School Accommodation Scheme for a new Science Lab and a Woodwork Room with associated facilities. https://t.co/4N0CqZVeVl
1485635171445612546	2022-01-24 15:26:41+00:00	📢 #Nitelink services will return this Friday 28th January across 13 Dublin routes.   It will complement existing 24-hour services which are already currently in operation seven days a week 👍  Well done @dublinbusnews 👏 https://t.co/3fTWkykN24
1485619126525698051	2022-01-24 14:22:55+00:00	Great news from Minister Charlie McConalogue - €35 million has been allocated to rejuvenate public piers and harbours across the country   This will support @dlrcc &amp; @DubCityCouncil who are responsible for maintenance and repairs to Dún Laoghaire, Coliemore and Bullock harbours https://t.co/bj1wrega8N
1485613485685891075	2022-01-24 14:00:31+00:00	@mobyandmustard Hi M&amp;M, thanks for the message. I raised this last week. I understand Public Health feel masks should be retained in schools and on public transport etc until the end of February, the reasoning is people choose to go to pubs, kids are obliged to go to school.
1485612308290326532	2022-01-24 13:55:50+00:00	Great news from Minister Norma Foley - many local schools in Dún Laoghaire have been given the green light for badly needed improvements &amp; maintenance works under the Summer Works Programme.   It is part of a €65m allocation to support 497 projects across the country 👍 https://t.co/D13BPZjU1v
1484592851413577733	2022-01-21 18:24:52+00:00	Such positive and welcome news from @MichealMartinTD today with lifting of almost all Covid-19 restrictions. #SpringIsComing 🇮🇪 https://t.co/WLtc5EyVc9
1484150868660391943	2022-01-20 13:08:35+00:00	@jm_pas_les_gens Thanks for the feedback. I can see the benefit of a summer BH, perhaps in July. But there was a strong push for St. Brigid's Day, there is a long gap from NY to St. Patrick's Day. TBF all workers will benefit, with a day off, in lieu, or extra pay.
1484149719953809409	2022-01-20 13:04:02+00:00	@RobbieLoughlin Hi Robbie, the arrangements will be finalised, they are saying end of Feb/March.
1483799789938610176	2022-01-19 13:53:32+00:00	In remembrance of people who lost their lives due to the Covid-19 pandemic, a public holiday &amp; Day of Remembrance &amp; Recognition will take place on 18 March this year. In addition there will be a new annual public holiday at the start of February, from 2023 to mark St Brigid's Day https://t.co/3UxrcUnJgu
1483798865514057739	2022-01-19 13:49:51+00:00	Great to see recognition of frontline healthcare workers who made such a huge effort to protect us all from the worst impact of Covid-19, they will receive a once-off tax-free payment of €1,000. https://t.co/q57FxTR1RI
1483792976480456704	2022-01-19 13:26:27+00:00	Encouraging news - 30,724 housing commencements were recorded last year. New starts for 2021 are almost the same as the combined totals for 2016 and 2017 (30,816). #HousingforAll https://t.co/pXeiT8WIAd
1483790895849824259	2022-01-19 13:18:11+00:00	@PaulAnthonyWard Happy Birthday Paul
1482404524690137090	2022-01-15 17:29:15+00:00	Huge turnout in Dún Laoghaire to support the #VigilforAshling, a very moving and poignant gathering https://t.co/8xOZyKu6jr
1482039877986365448	2022-01-14 17:20:16+00:00	Remembering Ashling Murphy and all women who are and have been victims of violence. There must be zero tolerance of violence against women. #VigilforAshling https://t.co/6ot1qtCcgg
1481592112781086725	2022-01-13 11:41:00+00:00	Such a shocking crime. Thoughts and prayers with Ashling Murphy's family, friends, her students and the entire community in Tullamore who have suffered such a dreadful loss. https://t.co/JYuMUMUhlL
1480637969195282437	2022-01-10 20:29:35+00:00	Good advice from Dublin Fire Brigade. We all need reminders of fire safety….   #FireSafety https://t.co/XHZAY4D8GZ
1479080817498509321	2022-01-06 13:22:01+00:00	@RTENewsPaulC Very cool - Wondering if Christine will make you a funky tie for your next broadcast?? 😂
1478416415434723328	2022-01-04 17:21:55+00:00	🏡🏡🏡 Eligibility criteria for Local Authority Home Loans has been expanded - this will be particularly useful for applicants with a single income and people who need a fresh start to secure a new, 2nd hand or self-build home 👍  For more information ⤵️  https://t.co/wC9bnsGnb4 https://t.co/oAN6nxuxS4
1478313107139309575	2022-01-04 10:31:25+00:00	Well done to all of the many volunteers, delighted to see the continuous improvement in Dún Laoghaire Town’s ranking in the annual Irish Businesses Against Litter (IBAL) survey. This year the Town comes in at 6th place with “Cleaner Than European Norm”  https://t.co/zs8YrbawXO https://t.co/FA4a37lPJf
1477378716120625155	2022-01-01 20:38:28+00:00	My companion on this day in 2021 and again today for my #100daysofwalking A lovely afternoon walking on #Killiney Beach. 👣 🐾 https://t.co/8zuqczPsnX
1477041590594117636	2021-12-31 22:18:51+00:00	Wishing you all a very happy New Year and a wonderful 2022 https://t.co/pp9EO6143z
1476813859008700430	2021-12-31 07:13:56+00:00	@sheanamw Sorry to hear this Shéna, if you can dm me your info or email me cormac@cormacdevlin.ie , I’d be happy to raise this issue for you.
