27955396156	2010-10-20 18:41:58+00:00	Special City Council Housing Meeting on Monday the 1st November 2010
28975498601	2010-10-28 10:19:40+00:00	Soul destroying to watch Government and toothless Opposition. Time for real left to unite and articulate a positive and alternative vision.
29582541581	2010-11-03 15:41:42+00:00	Blog Report on Special Housing Meeting held on the 1st November can be view on http://catherineconnolly.blogspot.com
2635301373607936	2010-11-11 08:14:39+00:00	I welcome and support Human Rights Commission  call for a statutory inquiry into the treatment of women and girls in the Magdalene Laundries
3157061319794688	2010-11-12 18:47:56+00:00	IHRC Report on Magdalene Laundries http://www.ihrc.ie/newsevents/press/2010/11/09/ihrc-calls-on-the-government-to-immediately-establ/
3499341373247488	2010-11-13 17:28:02+00:00	Release of Aung  San Suu Kyi wonderful news-Freedom of Galway City bestowed on her on the 16.6.2005 –I had the privilege of being Mayor
6773593945931776	2010-11-22 18:18:45+00:00	Official Launch  of  my election campaign will take place on Monday the 29th November at 7pm in Park House Hotel, Galway
6773763093823488	2010-11-22 18:19:25+00:00	I will be attending public meeting tonight in the Menlo Park Hotel Galway organized by Hope 4 Disability.
7785646273855488	2010-11-25 13:20:17+00:00	Searched in vain for ‘We are sorry’ in the National Recovery Plan- found instead a smug  Government  punishing  those least responsible!
8489618894753792	2010-11-27 11:57:37+00:00	I endorse the One in Five Campaign to highlight Domestic VIolence formally released balloons from Millennium Bridge Thur 25th
8490184949637120	2010-11-27 11:59:52+00:00	Join us on the streets of Dublin and let them see and hear us we are not going away
9240476511113216	2010-11-29 13:41:15+00:00	Ostán Park House ag a 7 i.n. an 29ú Samhain-seoladh Oifigiúil
9541091921498112	2010-11-30 09:35:48+00:00	Park House –Election Launch 2010 speech http://tinyurl.com/29mrzra
9541410336280576	2010-11-30 09:37:04+00:00	Successful launch of Election Campaign in Park House Special thanks to all who braved the weather and to Cllr OCuaig who chaired the meeting
9650175773511681	2010-11-30 16:49:15+00:00	What has happened with the bailout is that it has created socialism for the rich and capitalism for the poor!
10810392238358528	2010-12-03 21:39:33+00:00	Cuireadh agam chuig dinnéar Cumann Huícéirí na Gaillimhe in Óstán Charna Oíche Shathairn, 4ú Nollaig. Beidh mé ann.
10821598445576192	2010-12-03 22:24:04+00:00	Reminder to join the protest against the cuts- Galway-4th December at 1pm outside the Cathedral. I will be speaking at the protest.
11389660504788992	2010-12-05 12:01:21+00:00	Mó bhuíochas do Chumann Húicéirí na Gaillimhe as ucht fáilte mhór a chur romham chuig a ndinnéar aréir. Bhain mé an sult as an oíche.
11801071206797312	2010-12-06 15:16:09+00:00	Proposed cut back of 1.2 million euro to Voluntary and Community Fora highlight in most acute way Government’s contempt for local democracy.
12224515572498432	2010-12-07 19:18:46+00:00	Reminder ‘The Pipe’ on in the Eye Cinema this week I would encourage everyone to go and congratulations to Risteard we are indebted to him.
12872195902541825	2010-12-09 14:12:25+00:00	Cut in blind pension says it all- Government has Eyes only for the Bankers   and it’s new Masters-IMF/EU-let us use our voice and vote.
14329276669100032	2010-12-13 14:42:20+00:00	Congratulations to Sarah Clancy on her new book of Poetry ‘Stacey and the Mechanical Bull’-I enjoyed both the launch and the book of poetry
14640992447631360	2010-12-14 11:20:59+00:00	Invitation to Aung San Suu Kyi to Galway City. blog link to PR http://bit.ly/gZXvsn
19804015000817665	2010-12-28 17:16:59+00:00	Systematic running down of our public health service continues http://bit.ly/hwKjCH
21258555877236736	2011-01-01 17:36:49+00:00	A Happy and Peaceful New Year to all and let’s make 2011 the turning point in changing our country to a more just and equal one for all.
22659633491480576	2011-01-05 14:24:12+00:00	Minister Ahern side steps Galway City  Council’s unanimous call for Independent Enquiry into the sinking of ‘Iona Isle’ http://bit.ly/h1Xh5o
24736264779472896	2011-01-11 07:55:59+00:00	Green legacy in housing - landlords will house our people 3693 in waiting list and not a euro to build or purchase http://bit.ly/e9yFQ1
24927243297886208	2011-01-11 20:34:52+00:00	Níl ciall ná réasún le Polasaí FG fáil réidh le Gaeilge mar árbhar riachtanach tar-eis an Teastais Shóisearaigh http://bit.ly/gxXZ09
26391769889378304	2011-01-15 21:34:22+00:00	Our Bank is two years old today! http://bit.ly/e5yEyS
28158217099943936	2011-01-20 18:33:36+00:00	Former Minister Mary Harney’s legacy in Galway City  http://bit.ly/i7dUE1
29497755990761472	2011-01-24 11:16:27+00:00	The ‘We are not the Sherlock Holmes’ Party have finally called it a day  or  two or three or four…..
30237375967797248	2011-01-26 12:15:26+00:00	Election Campaign. If you would like to join me and work on the campaign sent a personal message to cconnolly@cllr.galwaycity.ie
30742316398411776	2011-01-27 21:41:54+00:00	COMMON GOOD IGNORED IN THE INTERESTS OF THE FEW. http://bit.ly/g91wC3
32402106921000960	2011-02-01 11:37:18+00:00	The 30th Dáil will be dissolved shortly and the General Election will be in full swing. Read more  ..http://bit.ly/gGo0P3
32810677705900033	2011-02-02 14:40:49+00:00	Policies for the common good  http://www.scribd.com/doc/48034053/CConnolly
33102784437944320	2011-02-03 10:01:33+00:00	FF agus FG ag caint faoi Raiftearaí sa Dáil  agus an pinsean a ghearradh ar na daoine atá dall An rud is measa-ní fheiceann siad an ioróin!
33439042309865472	2011-02-04 08:17:43+00:00	Mise Raifteirí an File ..... http://bit.ly/fkn9vO
34597880673083392	2011-02-07 13:02:32+00:00	Tuesday the 8th February 2011 – final day for registering details here .... http://bit.ly/gDApAv
34666034317234176	2011-02-07 17:33:21+00:00	Speaking at a Forum organized by the Literary and Debating Society tonight at 9pm in the O'Flaherty Theatre in NUIG.
35291818849599488	2011-02-09 10:59:59+00:00	Catherine Connolly Student Nurses Protest Press Release here .. http://bit.ly/hoS2p4
35292019639336960	2011-02-09 11:00:47+00:00	Student Nurses Protest  outside the University College Hospital today between 12.30 and 1.30 pm -----
35342050505408512	2011-02-09 14:19:36+00:00	Speech given to Literary and Debating Society in the O'Flaherty Theatre in NUIG. link .. http://bit.ly/dRWGhq
35983833476112384	2011-02-11 08:49:49+00:00	Chuir an méid a bhí le rá ag an Aire O'Cuiv ag cruinniú poiblí ar an gCeathru Rua - faoi Banc Angla Éireannach- iontas agus alltacht orm-
35984395940667392	2011-02-11 08:52:03+00:00	Banc Angla Éireannach. ..... http://bit.ly/fzhlJA
37556145665089536	2011-02-15 16:57:37+00:00	New bridge to Fisheries Tower-matching funding awaited from Failte Ireland  http://bit.ly/h89nao
43805696118099969	2011-03-04 22:51:06+00:00	#GE11 #GYW Sincere Thank-you and here’s to working with you in the next general election!  http://bit.ly/fpnctg
44684400817995777	2011-03-07 09:02:46+00:00	Global Womens Studies Dept NUIG celebrate 100 yrs of Int Women's Day. The event will take place tonight @ 7.30 pm in Áras Moyola, NUIG
44873445758074881	2011-03-07 21:33:57+00:00	The proposal to sell off our forestry land is utter madness-we simply cannot let this happen.Use your signature @  http://bit.ly/eOgWzx
47307516983513089	2011-03-14 14:46:05+00:00	Update on funding for new Bridge to Fisheries Tower @ http://bit.ly/en3kCO
48013177337810944	2011-03-16 13:30:08+00:00	New Bridge to Fisheries Tower, detail here .. http://bit.ly/fGVVeA
53909363798188032	2011-04-01 19:59:28+00:00	1st April 2011 .... http://bit.ly/hkAOtK
60415284980359169	2011-04-19 18:51:41+00:00	Update on provision of matching Funding for new bridge to Fisheries Tower.  http://bit.ly/ifuzPT
68036714307919872	2011-05-10 19:36:31+00:00	Medical Card Applications ... http://bit.ly/iWDVNR
70845331625082880	2011-05-18 13:36:57+00:00	Beart a dhéanamh de réir do bhriathair. St Francis Public Nursing Home .. http://bit.ly/krwuUD
75947201217572864	2011-06-01 15:29:58+00:00	Embargo on employment of new staff at the Public Hospitals. My Blog can be accessed @ http://bit.ly/m235LV
76286692063068160	2011-06-02 13:58:59+00:00	Confirmation by Clinical Director of Galway’s Hospitals that lack of staff is the cause of empty beds,Theatres closed and long waiting lists
80590169627041792	2011-06-14 10:59:28+00:00	New Byelaws on permitted times for Street Performance. Detail here .. http://t.co/2KMcHOr
80678730531487744	2011-06-14 16:51:22+00:00	New Casual Trading Bye-laws.  Details here .. http://t.co/SlaLD1H
80731518703640576	2011-06-14 20:21:08+00:00	Music to our ears –  up  to  10 pm in Winter and 11pm in Summer. New Byelaws  best  solution  for both inner City Residents and Buskers.
81104211412140033	2011-06-15 21:02:05+00:00	'Justice for Magdalenes' Motion passed unanimously by all 15 City Councillors. Details .. http://t.co/CBUBdLG
85387807064981504	2011-06-27 16:43:34+00:00	Bridge to Fisheries Tower literally hanging on decision of Directors of Fáilte Ireland re matching funding for bridge http://t.co/wvS39sn
85744987521818624	2011-06-28 16:22:52+00:00	Campaign to keep St Francis Community Nursing Home Open.. update @ http://t.co/IiTrGAn
87825526521212929	2011-07-04 10:10:11+00:00	Update on Campaign to keep St Francis Community Nursing Home Open-2000 signatures and rising. 4th July 2011 http://t.co/bVog9FN
88636055212929024	2011-07-06 15:50:57+00:00	Appeal to Councillors and TDs to join campaign to save St Francis  Home –Sa chás seo caithfidh muid seasamh le chéile ar son na ndaoine
89590142511222784	2011-07-09 07:02:09+00:00	On Shop Street again today from 11am to 3pm or contact me directly at cconnolly@cllr.galwaycity.ie and I will email the petition to you
90775012897865729	2011-07-12 13:30:24+00:00	Decision to deny opportunity to Senator David Norris to address Galway City Council in September is scandalous.  http://t.co/mcPLqkF
92991616649932800	2011-07-18 16:18:23+00:00	18th July 2011: Update on the Save St Francis Nursing Home Campaign. Details @ http://t.co/eTls5kQ
93719324900073472	2011-07-20 16:30:02+00:00	Roll out of Cash for Cans Initiative -Well done to the Community Forum   more @ http://t.co/uwTBk8C
94709252404412416	2011-07-23 10:03:40+00:00	Signature campaign to save St Francis Shop Street today from 11am to 3pm. Also @ Joseph’s church tonight before and after the 7pm mass
95504517721894912	2011-07-25 14:43:46+00:00	A special thanks  to  Fr Martin Downey and  Fr David Murphy  for facilitating the St Francis Home Petition.
95504636949180416	2011-07-25 14:44:14+00:00	6,000 people say do not close St Francis Nursing home and campaign gathering strength
95515818628100096	2011-07-25 15:28:40+00:00	25th July 2011: Update on campaign to save St Francis Nursing Home PR here : http://t.co/PV9utOJ
96594384233054208	2011-07-28 14:54:30+00:00	Cash for Cans Initiative : have now been given absolute assurances that the scheme will be up and running on 2/8/11 http://t.co/AhMoqCN
101764601217167360	2011-08-11 21:19:06+00:00	Campaign going very well-up at 8,000 signatures and going strong. PR @ http://t.co/0DQGq8T
101764913596350464	2011-08-11 21:20:20+00:00	Cash for Cans - Despite initial difficulties, this initiative is now up and running- let's use it and make Galway City a cleaner place.
109645304214724608	2011-09-02 15:14:12+00:00	St Francis Home Campaign - Back on Shop Street again with our signature campaign -on Saturday the 3rd September from 11am to 3pm.
111151644166729728	2011-09-06 18:59:51+00:00	9000  signatures to save St Francis Nursing Home and rising!
111152321769119744	2011-09-06 19:02:33+00:00	If Mayor serious about alleviating traffic let her call on the Government for the 25million to implement Smarter Travel Action Plan for City
111541936606806017	2011-09-07 20:50:44+00:00	Meeting of the Environment Strategic Policy Committee (SPC) at 4pm Thursday. Details @ http://t.co/rgXW0Rs
113200472210411520	2011-09-12 10:41:10+00:00	10,000 signatures tell the HSE West and the Local TDs and Councillors to keep St Francis Nursing Home open. PR @ http://t.co/xa1yDyZ
113291504700751872	2011-09-12 16:42:54+00:00	My Introduction speech as chairwoman of the first session of the 23rd Desmond Greaves Weekend School 9th September 2011 http://t.co/oMLSEdY
116047094476845057	2011-09-20 07:12:38+00:00	100,000 used cans taken off the streets of Galway under Cash for Cans Pilot Scheme in one month-well done everyone-let’s do it permanently
116219925277847552	2011-09-20 18:39:24+00:00	12,000 call on HSE West to keep St Francis open-closure utter madness with 33 patients in Regional waiting for transfer to nursing homes.
118004828948537344	2011-09-25 16:51:58+00:00	Public Meeting Monday- 26th September  8pm - Westwood Hotel organized by Campaign to Save St Francis Home-The Residents deserve our support
118770344801734656	2011-09-27 19:33:51+00:00	Five TDs and Senator call on HSE West to keep St Francis Open and seek urgent meeting with Minister for Health following public meeting
121124125291974656	2011-10-04 07:26:56+00:00	Save St Francis Home Campaign-Almost 16,000 Signatures-Join us and make it 20,000 and let’s tell them what kind of society we want.
121124380033036289	2011-10-04 07:27:57+00:00	Commencement and completion dates for Knocknacarra Community Centre at Cappagh Park-27th February 2012 to 27th February 2013- Alleluia.
124058072732803073	2011-10-12 09:45:24+00:00	Public Meeting in Radison Hotel at 2pm on Wednesday the 12th October 2011 in relation to Radon Gas levels in houses in the City.
124060097474338816	2011-10-12 09:53:26+00:00	#SSF 17,000 signatures and the campaign continues Awaiting word from the Government TDs in relation to a meeting with the Minister.
126628418606481408	2011-10-19 11:59:02+00:00	#ssf 18,000 signatures collected and the campaign continues.  More detail @ http://t.co/r4hpiGQw
128905980070207488	2011-10-25 18:49:15+00:00	The Proposed Changes to the Constitution on the 27th October 2011 Read my blog @ http://t.co/FBaJQgLy
132086123752210432	2011-11-03 13:26:00+00:00	#SSF ‎19,000 people have signed the petition. Signature campaign continues on  Shop Street on Saturday from 11 am
134606197465694208	2011-11-10 12:19:52+00:00	#SSF 20,000 Signatures read blog & PR @ http://t.co/DnQ4W2nO
135989398092259328	2011-11-14 07:56:13+00:00	Symposium on viability of rolling out Public Bikes Scheme in Galway City. Read detail @ http://t.co/cLR0IAbS
136831221186568192	2011-11-16 15:41:19+00:00	#SSF 21,200 Signatures read blog @ http://t.co/eIMbCHUW and motion passed by 14 out of 15 City Councillors @ http://t.co/UJbIlQI7
138705681086820354	2011-11-21 19:49:46+00:00	#SSF St Francis 22,500 Signatures and still a deafening silence from Deputies Walsh Kyne Nolan.Time to stand with the people or stand down
138707619006255105	2011-11-21 19:57:28+00:00	#SSF Latest blog can be read @ http://t.co/gTLHL6CH
141224452275970048	2011-11-28 18:38:27+00:00	Good News-work in progress to end discharge of raw sewage into the river from 40 houses in the Claddagh Area. PR here : http://t.co/P7qKyeH4
141602377420648448	2011-11-29 19:40:12+00:00	#SSF Save St Francis Campaign has reached the tipping point-Solidarity March @ 2pm on Sunday the 4th Dec details & PR @ http://t.co/hLuDyRQo
141938343993806849	2011-11-30 17:55:12+00:00	#SSF   Save St Francis Campaign poster  http://t.co/OYTi5zQE
141939937753841664	2011-11-30 18:01:32+00:00	#SSF St Francis Campaign petition can be download @ http://t.co/KQuNnESv
141984969110196225	2011-11-30 21:00:29+00:00	#SSF Open Letter to the Residents of Galway http://t.co/L1GOylp7
142998018763915264	2011-12-03 16:05:59+00:00	#SSF Save St Francis Campaign Solidarity March at 2pm on Sunday the 4th December, assembling at the Cathedral Car Park.
143757987100635136	2011-12-05 18:25:49+00:00	#SSF Confirmation of meeting with Minister for Health on Thursday the 8th December welcomed by Save St Francis Home Campaign Committee.
143761783935610880	2011-12-05 18:40:54+00:00	#SSF Photos & blog from yesterdays march http://t.co/UZ9E8l5r
145583143888502785	2011-12-10 19:18:20+00:00	Read blog re Meeting with the Minister for Health on Thursday the 8th December  http://t.co/SEWrhDrW
146344938630692864	2011-12-12 21:45:26+00:00	Unpardonable Galway to be left without public nursing home under Labour  Minister for the elderly 25,000 signatures will they listen now?
146345118721519616	2011-12-12 21:46:09+00:00	Fisheries Tower: Broken Bridge over troubled waters literally hanging on the decision of Directors of Fáilte Ireland on Wednesday the 14th.
146347138740256768	2011-12-12 21:54:11+00:00	Broken Bridge over Troubled Waters! http://t.co/ptr9ze2a
169414175116886016	2012-02-14 13:34:21+00:00	Latest on St Francis home @ http://t.co/5eLeBgoC
169414737887629312	2012-02-14 13:36:35+00:00	Chairing meeting tonight in the Town Hall on proposed new Fiscal Treaty at 8.30pm.Speakers: Robert Ballagh & Terry McDonough
187892055618498560	2012-04-05 13:18:51+00:00	Historic day for Knocknacarra-Contracts signed Wednesday for construction of new community centre at Cappagh Park, Knocknacarra, Galway.
194408264270741505	2012-04-23 12:51:56+00:00	Invitation to the Taoiseach to visit St Francis when in Galway on Monday the 30th April Has he the courage to do the decent thing?
197228708774412289	2012-05-01 07:39:23+00:00	First time in approximately 50 years allotments to be rolled out with pilot project in Shantalla starting in May.  http://t.co/wJyMTk7g
200238956137287680	2012-05-09 15:01:02+00:00	14th May final date for inclusion on electoral register. One stop shop Mon in City Hall just bring photo identification http://t.co/puaibt6r
204549727977607170	2012-05-21 12:30:30+00:00	Sad week for Galway and shameful week for Government Senator, TDs as St Francis Community Nursing Home closes its doors http://t.co/5oz96AaN
207113413749510144	2012-05-28 14:17:40+00:00	Fiscal Treaty : http://t.co/yo48kRCF sets out in detail why I am advocating a No Vote.
207825354688167936	2012-05-30 13:26:40+00:00	#VoteNo FISCAL TREATY DEFLECTION, DISTRACTION AND DECEIT @ http://t.co/iTp7cmx4
208190094333587456	2012-05-31 13:36:01+00:00	Policy of Deflection, Distraction and downright Deceit continues unabated. Time for  Despair or Time to fight back?http://t.co/mHWLO4bz
212556072685285376	2012-06-12 14:44:51+00:00	4679 - Households on Galway City Council Housing Waiting List with 145 more applications waiting to be processed. http://t.co/H2kteppA
214680236879650816	2012-06-18 11:25:31+00:00	Aung San Suu Kyi to be honoured in Dublin today http://t.co/pr9faUp4
215128275205361664	2012-06-19 17:05:52+00:00	#ASSK Happy 67th Birthday  Aung San Suu Kyi and hopefully as you ask, we may learn to use our liberty to promote the liberty of others
228558019347247104	2012-07-26 18:30:52+00:00	South Park following the Volvo Ocean Race  @ http://t.co/oPM83vkq
251622849352187904	2012-09-28 10:02:16+00:00	Comerford House at the Spanish Arch must us retained and used for cultural and community purposes only. @ http://t.co/1miRaP3h
251623363527708672	2012-09-28 10:04:19+00:00	Land Aggregration Scheme -Creative Accounting with no questions asked!  http://t.co/l03JoKJC
254313838877503488	2012-10-05 20:15:18+00:00	Áras Mhic Dara, An Cheathrú Rua-Ionad Lae Dúnta!, http://t.co/7GPXc599
254314132369715200	2012-10-05 20:16:28+00:00	Pedestrian Bridge Support Piles left in the water by 'Let's Not Do It Galway'! http://t.co/dZA776Br
255212609542975488	2012-10-08 07:46:42+00:00	Áras Mhic Dara, Carraroe-  Day Centre to reopen on Monday the 8th  October http://t.co/aDk1xi9l
256646100121952256	2012-10-12 06:42:53+00:00	Walking and Cycling Strategy for the City and it's Environs http://t.co/vvA9ljLr
258304407458955264	2012-10-16 20:32:24+00:00	Replica Statue of Padraig O'Conaire must be put back in Eyre Square http://t.co/4TZoHgw3
259370543894110210	2012-10-19 19:08:51+00:00	Up-date on removal of 8 metal structures .... http://t.co/QTPYgsrI
260347319826927617	2012-10-22 11:50:12+00:00	Last Chance to ensure you are on the Register of Electors Galway City Council's  'One Stop Shop' facility at City Hall Tues 9am and 4pm.
262089933022441472	2012-10-27 07:14:44+00:00	Further severe cut backs in Home Help Services in Galway City and County.  http://t.co/Hx0vipCZ
266574416849281024	2012-11-08 16:14:28+00:00	The Children’s Referendum - my views @ http://t.co/gvkEzNh7  #crref  #chref12
268743575125233664	2012-11-14 15:53:55+00:00	Independent investigation into the death of Savita Halappanavar required  http://t.co/2uAfEmDy
270603820621516800	2012-11-19 19:05:53+00:00	Book of Condolences for Savita Halappanavar  detail of location can be found @ http://t.co/lbRo0qSj #savita
270930007533158401	2012-11-20 16:42:02+00:00	Independent Enquiry into the death of #Savita Halappanavar is absolutely essential.  http://t.co/vtRdTqO0
270945417951342592	2012-11-20 17:43:16+00:00	Independent Investigation into the unfortunate death of #Savita Halappanavar in tatters.  http://t.co/3Ub29rKO
270964275797962752	2012-11-20 18:58:12+00:00	Dr OReilly failure to insist on independent enquiry from the start raises serious questions about his judgement http://t.co/As4H4Edc #Savita
271327725371920384	2012-11-21 19:02:25+00:00	Minister Reilly's decision to proceed with investigation into the death of of #Savita Halappanaver is simply wrong.  http://t.co/5kFbDv0E
271569247598161922	2012-11-22 11:02:08+00:00	At tale of arrogance, incompetence and plain stupidity. #Savita http://t.co/ewrI1bYP
271652379907198978	2012-11-22 16:32:29+00:00	Clarification at last: A clinical review is in progress and not an independent enquiry! #Savita http://t.co/eKwwKtWh
272253151866933248	2012-11-24 08:19:44+00:00	Further Clarification ! #Savita http://t.co/lwWY51of
273770093954101248	2012-11-28 12:47:31+00:00	Very serious issues remain to be addressed in relation to the role played by the HSE/NIMT http://t.co/bdkuloXH #Savita
275534378036240384	2012-12-03 09:38:09+00:00	International Day of Persons with Disabilities #IDPDchat http://t.co/ZjzTx2yM
275956083502219265	2012-12-04 13:33:51+00:00	Update on new Community Centre for Knocknacarra- all postive  http://t.co/hpXwiPVN
278476847489110017	2012-12-11 12:30:28+00:00	‘Welcome To Our World’   http://t.co/hKnKz0fp
278860188407197697	2012-12-12 13:53:44+00:00	Coláiste na Coiribe- Cruinniú Poiblí/Public Meeting at 7.30 in the Salthill Hotel on Thursday the 13th December. http://t.co/qMwnXgCr
290766845772980224	2013-01-14 10:26:32+00:00	Return by Galway City Council of valuable Art Collection  http://t.co/wBA7kNO9
291248303306338304	2013-01-15 18:19:41+00:00	Update on ‘Return of Art Collection’ by City Council. http://t.co/ODFDtwpZ
291248672723849216	2013-01-15 18:21:09+00:00	'Welcome to Our World' shown at City Council meeting on the 14th January 2013.  http://t.co/TTQpacmc
298783288808574976	2013-02-05 13:21:01+00:00	Update on Establishment of Hospital Groups/Trusts in #Galway /Roscommon http://t.co/xYNZgMRN
298787484815462400	2013-02-05 13:37:42+00:00	Let's hope the Government will have the sense to give an unreserved apology on publication of report later today on the #Magdalen Laundries
299140578472521729	2013-02-06 13:00:46+00:00	#Magdalen Report : Failure by Taoiseach and Minister Shatter to give unreserved frank apology is unforgiveable. http://t.co/3YU8Y9FS
303914705234305024	2013-02-19 17:11:26+00:00	#Magdalen   A  full  apology from the Government- an absolute first step in the healing process for all of us. http://t.co/gKL1FHKg
303970682864279552	2013-02-19 20:53:52+00:00	#Magdalen : Full &amp; unconditional apology by the Taoiseach on behalf of the gov &amp; country has to be welcomed.  http://t.co/ghF9yOac
306497142841815041	2013-02-26 20:13:07+00:00	Former Residents of the Magdalene Laundry in un-named grave in Bohermore Cemetery. #Galway http://t.co/MN0iKqSRNS
306500183015976961	2013-02-26 20:25:12+00:00	At last: scaffolding erected and work on installation of new bridge to the Fisheries Tower underway. #Galway http://t.co/JUKuLAdwJ9
378242763403165696	2013-09-12 19:44:36+00:00	Ar ais tar éis sosa! ...Coláiste na Coiribe-An Bord Pleanála http://t.co/YQtMTu0E9s
384673794926718977	2013-09-30 13:39:14+00:00	I am urging a No Vote to the abolition of the Seanad http://t.co/i5RQC9WgpW
385737552558166016	2013-10-03 12:06:13+00:00	Abair Leo No! http://t.co/r2lU8sz9hE
386579235625631744	2013-10-05 19:50:46+00:00	comhghairdeas-bhí an lá linn agus bhí sé tuillte againn! #seanref
428451056125624320	2014-01-29 08:54:26+00:00	Mental Health Services in Galway East and West http://t.co/oyEaefKCwS
434373730374926336	2014-02-14 17:09:02+00:00	Psychiatric Department Galway Regional  Hospital #galway #timetotalk #mentalhealth #mentalhealthawareness http://t.co/uR8iuLFtW7
435481618019389441	2014-02-17 18:31:23+00:00	Lá Mór na Gaeilge. #gaeilge  #gael http://t.co/2IM6Ufy3jX
436121595254296576	2014-02-19 12:54:25+00:00	Galway City Council should work in partnership with the people of Knocknacarra and operate the new  Centre #galway http://t.co/kKqjhLiw7m
441201383102889984	2014-03-05 13:19:41+00:00	Application for new Galway Docks Development currently before An Bord Pleanála. http://t.co/QKu2zEdVfY
441212851609292800	2014-03-05 14:05:15+00:00	Mórshiúl: Slán le Seán http://t.co/jkGo40u9ST
443386088715866112	2014-03-11 14:00:55+00:00	Positive news re sustainable solution to flooding at Toft Park http://t.co/Mi1DEuUylu
444190330674360321	2014-03-13 19:16:42+00:00	Situation at the Psychiatric Department in the Regional Hospital. http://t.co/C8JvkO5YCB
444190788931440640	2014-03-13 19:18:31+00:00	Vacant City Council Houses http://t.co/Wv3R3qn3k8
