id	created_at	full_text
1392461064118407168	2021-05-12 12:46:03+00:00	#Palestine #PalestineWillBeFree #GazaUnderAttack #WeStandWithPalestine #SavePalestine https://t.co/jZ96lDyF13
1392152632614170628	2021-05-11 16:20:27+00:00	This country is in the midst of an unprecedented mental health crisis. the government need to remove the barriers for people wanting to become psychologists if we are serious about tackling the problem. https://t.co/wvGvDAlbmN
1391742404043083778	2021-05-10 13:10:21+00:00	Utterly shocking. Israeli settler drives into a Palestinian in Jerusalem! The Irish government must condemn settler provocation, evictions of Palestinians in East Jerusalem &amp; brutality of Israeli police against Palestinians at Al-Asqa. We need sanctions against Israel now @pb4p https://t.co/jn8fRXfDO4
1390602354886578177	2021-05-07 09:40:12+00:00	Due the sad death of Edith Ngwenya, one of the tenants at St Helen’s Court, our protest at 1.30 today has been cancelled as a mark of respect.  Our thoughts are with her husband, Onani, and their daughter Sicelo.
1390551721471057922	2021-05-07 06:19:00+00:00	Join us today at 1.30 for a socially distanced demo outside St Helens Court in Dún Laoghaire in solidarity with residents facing eviction by their ruthless vulture landlords.  Please wear a face covering and observe social distancing at all times. https://t.co/IyhTmkRt0l
1390287959723843584	2021-05-06 12:50:54+00:00	The rampage of cuckoos, vultures &amp; property bloodsuckers is a result of a deliberate FG/FF policy. The next step in this disastrous saga is the LDA bill going through #dail which will allow developers &amp; speculators to plunder the public land bank  @pb4p https://t.co/0LoaXCcTb5
1390280584455405569	2021-05-06 12:21:36+00:00	Told @LeoVaradkar in #dail today that rampage of cuckoos, vultures &amp; property bloodsuckers is a result of a deliberate FG/FF policy. Next step in this disastrous saga is LDA bill going through #dail which will allow developers &amp; speculators plunder the public land bank @pb4p https://t.co/yrVcFVbgf7
1389939999362195456	2021-05-05 13:48:14+00:00	"€450,000 for an ""Affordable Home""? What planet are this lot living on? https://t.co/VeJcMpwAYO"
1389691999037632516	2021-05-04 21:22:46+00:00	Gov affordable housing scheme a joke. Caps of €450k in Dun Laoghaire/Dublin City will drive ordinary people out of the city. On @VirginMedia_TV shortly discussing this @TonightVMTV @pb4p
1387716318548447234	2021-04-29 10:32:07+00:00	Friday*
1387698023761862658	2021-04-29 09:19:25+00:00	Join us tomorrow Thur 30th of April for a socially distanced demo outside St Helens Court in Dún Laoghaire in solidarity with residents facing eviction by their ruthless vulture landlords.   please wear a face covering and remain socially distanced at all times. https://t.co/7qew9F7fiU
1387391168154058754	2021-04-28 13:00:05+00:00	Tomorrow the four main taxi drivers unions were to have a socially distanced and safe protest where they would remain in their cars.  Drew Harris and the Gardai have banned this protest on public health grounds, this is a shocking abuse of power and an attack on workers rights. https://t.co/uAA31i250v
1387370435973550083	2021-04-28 11:37:42+00:00	#PassTheUSIBill https://t.co/CaaKvCuLtZ
1387366162032431112	2021-04-28 11:20:43+00:00	Shocking! Gardai just banned tomorrow’s Taxi protest seeking support for a devastated industry. Drivers will be IN cars,yet #drewharris using public health to ban protest.This follows #Debenhams episode on Thurs. So, strikebreaking is essential but workers protesting is banned!
1385388802680791041	2021-04-23 00:23:24+00:00	Shocking what’s happening here on Parnell street. ⁦@gardainfo⁩ hauling workers out of #debenhams. Why is ⁦@irishgov⁩ facilitating this. ⁦@MichealMartinTD⁩ ⁦@LeoVaradkar⁩ ⁦@pb4p⁩ https://t.co/VMFZCRukIn
1385375249395556355	2021-04-22 23:29:33+00:00	On Parnell street. Hundreds of gardai acting in collusion with KPMG trying to break the year long #debenhams strike in the middle of the night. Come down to support if you’re around. This is a fight for all workers. ⁦@pb4p⁩ ⁦@morningireland⁩ ⁦@NTBreakfast⁩ https://t.co/58PrkcFm5i
1385265003658416135	2021-04-22 16:11:28+00:00	Standing with residents and locals outside St Helen's apartments, today as the community showed massive solidarity to support the residents facing eviction.  These vulture funds cannot be allowed to throw ordinary working people out onto the streets just to make a bigger profit. https://t.co/l7R5cjBA0d
1385198024423530496	2021-04-22 11:45:19+00:00	Residents*
1385193593619501056	2021-04-22 11:27:43+00:00	Raised in the Dail yesterday  Please join us at 1.30pm to stand in solidarity with the residence of St Helens in the face of eviction by Mill Street vulture funds.  It is vital that anyone that can make it wears a face covering and maintains social distancing at all times. https://t.co/RDga0Dc95m
1384982998379077636	2021-04-21 21:30:53+00:00	@psychpolis Glad to speak up for you and all the young people who want to qualify as Psychologists and help address the mental health needs of so many people. Well done to you Mark and to all those student psychologists who are now campaigning for this change which must happen!
1384890294571880450	2021-04-21 15:22:30+00:00	Instead of making it easier for students to become psychologists, we are charging up to 15k per year for them to study. As a result, waiting lists for mental health are enormous and people from working-class communities are priced out. The government must do better! https://t.co/oGUwRG7Yxs
1384498907309232132	2021-04-20 13:27:16+00:00	Standing with ex-Debenhams workers today outside the Dáil as we launch the Solidarity-People Before Profit bill that would seek to stop the horrible treatment these heroic workers have received from being inflicted on others in the future. #Debenhams https://t.co/o8j2ZyF629
1381901087045718021	2021-04-13 09:24:28+00:00	Disgraceful! Guards escorting strike breakers into #debenhams stores this morning. @MichealMartinTD @LeoVaradkar - are you going to allow this to happen? @pb4p https://t.co/VhfaqXjcYk
1380492841676382210	2021-04-09 12:08:36+00:00	DAY 365   Shame on you @merrionstreet @KPMG_Ireland   #SupportDebenhamsWorkers #Debenhams #Dublin  #StrikingIsNotACrime  #DontPassDebenhamsPicket  #Ireland #Cork #UK #KPMG #Sale #FF #12months #1year  #365days #YearLongStillStrong
1377550436933193732	2021-04-01 09:16:32+00:00	Students from working class backgrounds are priced out of psychology. https://t.co/ssEIV5dx0f
1377509634320310274	2021-04-01 06:34:24+00:00	Small businesses need much more supports. https://t.co/M4dmHN47h3
1377294557172355077	2021-03-31 16:19:45+00:00	The government must fund the free hot school meals programme for Scoil Cholmcille and all other DEIS schools https://t.co/j4QACmZKbr
1377192063339536384	2021-03-31 09:32:29+00:00	This is an appalling breach of the trust of vulnerable children and their families. There are many questions that need urgent answers. Who are the senior civil servants who ran this spying operation?  How much did Ministers for Health know? https://t.co/Oo1aNKq64o
1376957969288552450	2021-03-30 18:02:17+00:00	#JabsForTheBoys Beacon CEO must resign https://t.co/wPpTpkTyhI
1376570238096052227	2021-03-29 16:21:34+00:00	I wrote to Business Cttee of #Dail to demand time is set aside this week for the Minister of Health and the 3 ex health ministers, @MichealMartinTD @LeoVaradkar @SimonHarrisTD, for a Q&amp;A on the shocking reports of dept of health holding secret files on children with autism @pb4p
1376473952764133380	2021-03-29 09:58:58+00:00	Conference for An Alternative United Ireland on April 24th. Brilliant line-up that includes @bridsmithTD @ailbhes @GerryCarrollPBP  @saoirse_mchugh  @Kieran_Allen_ Register now here https://t.co/z2Niey0nXe #UnitedIreland https://t.co/h7OIsKKKYz
1375385137941204994	2021-03-26 09:52:24+00:00	Scandal of depts of health and Ed keeping secret files on children and families, shows the sinister state that gave us mother and baby homes, Magdalene laundries and industrial schools is alive and well. @pb4p
1375148240568524800	2021-03-25 18:11:04+00:00	https://t.co/7nUq7Ps6mW https://t.co/7nUq7Ps6mW
1375070219043999744	2021-03-25 13:01:02+00:00	Government of landlords, failing on housing &amp; tenants rights https://t.co/rlEIeWHR9q
1375028030628855814	2021-03-25 10:13:23+00:00	There has been a lot of lip service from the Government on young people and their mental health, we need real action to support our youth. If the Government parties are serious they will support our bill to #RemoveTheBarriers https://t.co/rQJv4s6T6y
1374741001877749761	2021-03-24 15:12:50+00:00	Movement for abortion rights is an all-Ireland movement https://t.co/D1ygzvWtsE
1374348358219882496	2021-03-23 13:12:37+00:00	ABOLISH FEES for public third level education. On Thur March 25th, TD's will vote on our bill for a radical reform of access to third level education. Please contact your TD's and urge them to vote in favour of the bill https://t.co/j2iebPED0c  #removethebarriers #abolishfees https://t.co/fLHuk4PVPh
1368870803618598917	2021-03-08 10:26:46+00:00	Interesting- @SimonHarrisTD announces CAO/3rd level reform, 3 days after @pb4p submit #dail motion, to be debated on thurs, calling for open access, the abolition of fees and removal of other barriers to third level. No coincidence! #ScrapFees #RemoveTheBarriers @TodaywithClaire
1367857703461224449	2021-03-05 15:21:04+00:00	Great to see. Well done to the Embassy. https://t.co/W2zN3FdcTR
1366401063679651852	2021-03-01 14:52:54+00:00	Some photos from the #RISEwithPBP press conference earlier.  The left is uniting to fight for workers' rights and ecosocialism, come to the online rally this Thursday: https://t.co/uu0JwsT8s8  If you haven't joined @pb4p yet, what are you waiting for? https://t.co/p4l6QVYLgY https://t.co/vqD0G9tyTq
1366397030092967937	2021-03-01 14:36:53+00:00	with the addition of @RISEsocialists and with a fairly dramatic growth in membership we feel, that we have the best opportunity since James Connolly was alive, to put radical, genuine socialist politics on the political agenda in a serious way. https://t.co/2kcVU2aHH2
1366393220486352899	2021-03-01 14:21:44+00:00	https://t.co/f2SD3lA8fn
1366024346494509058	2021-02-28 13:55:58+00:00	#RISEwithPBP https://t.co/JN7xdzaF7n
1365988529835245568	2021-02-28 11:33:39+00:00	A big welcome to @RISEsocialists &amp; @paulmurphy_TD #RISEwithPBP https://t.co/WmO8mUaA64
1365288416884256772	2021-02-26 13:11:39+00:00	While Ireland faces delays in supply of vaccine, a shocking 130 countries have yet to receive a single dose! Irish gov must join countries petitioning @wto to waive 'Intellectual Property' laws and allow countries produce their own vaccines. We need a #peoplesvaccine #nopatent https://t.co/1s5Whd8DTv
1364952697988931593	2021-02-25 14:57:37+00:00	Instead of paying student nurses, the government instead offered them a pathetic 100 euro allowance per week....which they STILL haven't received!   The disrespect seems to know no bounds. https://t.co/9R4nCKpP0l
1364533805164466179	2021-02-24 11:13:05+00:00	The failure of the Government &amp; #Taoiseach in new #covid plan to take decisive action on mandatory quarantine, enforcing non-essential work at home rules and pursue #ZeroCovid is the worst of all possible worlds &amp; will prolong the agony of long &amp; rolling lockdown @pb4p
1364258028934029320	2021-02-23 16:57:15+00:00	The Government’s handling of the pandemic has been shambolic and the expected proposals in the revised plan are dangerously defective  https://t.co/MbhLLaEksl
1362726047695962113	2021-02-19 11:29:42+00:00	Musicians, Events, and entertainment workers are in some cases being forced to sell their equipment.  The government needs to do more if we are going to have an events and entertainment industry at the end of this pandemic https://t.co/leVbPTLgku
1362110055366156289	2021-02-17 18:41:58+00:00	New land bill will not deliver real affordable or social housing, despite what Fianna Fáil say! https://t.co/HRh28hfm42
1362091452088598537	2021-02-17 17:28:03+00:00	Enough is enough. #PayStudentNursesandMidwives https://t.co/DcSJbvYmls
1361957515420958721	2021-02-17 08:35:50+00:00	@morningireland @DarraghOBrienTD LDA Bill blatantly facilitates transfer of public land bank to DAC’s that will partner with private investors &amp; won’t deliver genuinely public/affordable housing because based on market prices. It’s another NAMA scandal waiting to happen @pb4p
1361703775610802179	2021-02-16 15:47:33+00:00	This Bill is a shocking attempt by the government to totally abandon the idea of council housing and it is another NAMA scandal waiting to happen. It is a blatant vehicle for the privatisation of public land, and it will be the final nail in the coffin of genuine social housing. https://t.co/8B6QTGkPY9
1360725298678013952	2021-02-13 22:59:26+00:00	Fair play to Debenhams workers! https://t.co/m4yemFYRoD
1360280026315431937	2021-02-12 17:30:05+00:00	Totally disgraceful that many in Events ,Musicians, Taxis &amp; others such as Travel Agents without premises again excluded from #COVID19 support schemes, even though their livelihoods devastated Events businesses disappointed with Covid support plan https://t.co/zYYYdS6to2 via @rte
1359396322546241537	2021-02-10 06:58:34+00:00	government must grant supports for people and small biz, like taxi drivers, music events, sole traders etc, whose livelihoods have been hammered by covid, must also give fuel allowance to PUP recipients and increase the rate due to the extra time people are having to be at home https://t.co/pZwteqCCv3
1359222343462252544	2021-02-09 19:27:14+00:00	Beggars belief @LeoVaradkar &amp; @MichealMartinTD still think “Living with Covid” is possible after New Year disaster of infections, deaths &amp; overrun hospitals &amp; health workers. We need a #ZeroCovid strategy to get our lives back &amp; end the terrible cycle of surge &amp; lockdown. @pb4p https://t.co/6U9rMbCNV7
1359218671449747458	2021-02-09 19:12:38+00:00	But will the musicians, events &amp; arts workers, crew and taxi drivers be able to access these grants? It’s a disgrace they have been excluded from support schemes so far - they have been hammered financially, they must be included this time. @meaiireland @Epic2020_Group @pb4p https://t.co/PjSboC0icj
1358733541111128066	2021-02-08 11:04:54+00:00	Register here: https://t.co/PdRICR6uFJ If we do not shift to zero covid immediately, we will find ourselves in a 4th and even a 5th lockdown before the vaccine is rolled out across the country. To discuss this strategy please join us at this meeting on Mon 8 Feb 7PM https://t.co/ydQOmY1LeU
1358708752631947265	2021-02-08 09:26:24+00:00	This change only partially addresses injustice arising from disgraceful decision to raise pension age from 65 to 66. Even with this change 65 yr olds will get €2300 less a year than full pension. Pension age should go back to 65 @ingridmileyRTE @rtenews @davidmurphyRTE @pb4p https://t.co/2akIpYQXyd
1357340473132687362	2021-02-04 14:49:21+00:00	https://t.co/t6OK8uwoEd
1357311796521140235	2021-02-04 12:55:24+00:00	Join @pb4p to campaign for the things that can improve the lives of everyone in society- Zero-Covid, fair pay for a day’s work, climate action, workers' rights, migrant and refugee rights, an All-Ireland Health Service and end to the housing crisis #joinpbp
1357278323597053954	2021-02-04 10:42:24+00:00	I am in the @IrishMirror today giving my view on how the @DevilDebenhams dispute can be resolved. 🚨Spoiler Alert🚨 it can be resolved. Pick up a copy. #Debenhams https://t.co/778Sb2XiMI
1356994930519007234	2021-02-03 15:56:17+00:00	https://t.co/5XPv4ffYiz
1356994833043324929	2021-02-03 15:55:54+00:00	Government has abandoned workers in arts, entertainment, events. video in 2 parts https://t.co/aEWi0GNChq
1356974155724443652	2021-02-03 14:33:44+00:00	Will be speaking shortly in #dail on urgent need to extend grant and other supports to musicians, events &amp; arts workers who continue to suffer devastation during #COVID19 pandemic and are mostly excluded from existing covid grant schemes @meaiireland @Epic2020_Group @pb4p
1356882678683942912	2021-02-03 08:30:14+00:00	What do we mean when we call for a people's vaccine?  The people's vaccine is an initiative from Oxfam and Human Rights Watch for authorities around the world to wave Intellectual Property rights in regard to the Covid 19 vaccine. #PeoplesVaccine #COVID19 #ZeroCovid https://t.co/QJKIsRQXJT
1356874618926211075	2021-02-03 07:58:13+00:00	"""We find it mystifying that the government and NPHET would not see the value of trying to eliminate community transmission so that we could have some possibility of opening up in a sustainable way,” https://t.co/iHj5XuESYH #COVIDzero #COVID19ireland"
1356311007736508419	2021-02-01 18:38:37+00:00	@sinead00000 Great work Tara, thanks!
1356160773685456898	2021-02-01 08:41:39+00:00	#JoinPBP https://t.co/8yKxQlZPTW
1355278132081790982	2021-01-29 22:14:21+00:00	This is an admission that the Student nurses and midwives were doing essential work all along. So why not just pay them directly and admit the truth. @pb4p @bridsmithTD @Ginosocialist @INMO_IRL #paystudentnursesandmidwives https://t.co/dK73T30Dkc
1355120769320284166	2021-01-29 11:49:02+00:00	Disappointing Philip Nolan &amp; Paul Reid are citing essentially political reasons for not pursuing #ZeroCovid. Not surprising government don’t want to admit dire mistakes but issue of stopping non-essential travel &amp; pursuing elimination are political matters @ClaireByrneLive @pb4p https://t.co/kWnsWD0Uep
1354131896989585409	2021-01-26 18:19:37+00:00	@LouiseActon7 @aoifemcl @SocialCareWork1 Thanks for picking up for me Louise but in fact @aoifemcl and ISAG have been leaders in championing #ZeroCovid and briefing @pb4p last year on the science and rationale for adopting this approach.
1354083691820146690	2021-01-26 15:08:04+00:00	https://t.co/cPqDlFZ454
1354071877996707847	2021-01-26 14:21:07+00:00	Support for Zero-Covid has gained much ground since PBP first called for this strategy back in September of last year. We need all opposition parties and the government to get off the fence and back this strategy #health #news #today #pandemic #covid #virus #coronavirus https://t.co/bw9hHZYrbV
