id	created_at	full_text
1262790342572756992	2020-05-19 17:00:53+00:00	The council will be reopening Seapoint bathing area and the coastal path to the West Pier today, with Sandycove and the Forty Foot bathing areas reopening on Wednesday.  For more details on what's happening in Phase 1, click here: https://t.co/2sIAvWC5dd https://t.co/hs1k11Qovq
1262747428421120007	2020-05-19 14:10:22+00:00	we can't have a situation where essential childcare for healthcare workers or for others is dependent on what private insurance companies are willing to cover, we need the state to step in, there needs to be a national childcare service and it needs to be insured by the state. https://t.co/QgBeo634sI
1262708765389922305	2020-05-19 11:36:44+00:00	Asked CMO why we have high infection rate in  healthcare workers. 31% here, 15% in Spain/Italy. No answer, nor to more general question re testing regime for healthcare workers.  We need to see the advice that #NPHET are receiving. Have been asking for this since 16/03. #COVID19
1262703372592975872	2020-05-19 11:15:18+00:00	from 200 complaints about lack of physical distancing in work places currently working, not one inspection took place.  we need the HSA to take a proactive role in inspecting workplaces to make sure workers are safe. https://t.co/8PMFMgJCgw
1262685306114969600	2020-05-19 10:03:31+00:00	Attending Covid Cttee for PBP today. Will be questioning CMO/DoH/HSE. Also wrote on Fri to #Dáil business cttee for todays mtg saying we need more cttees to discuss all the urgent issues that  #Covid19Ireland has thrown up - mental health, public transport, job loss, poverty etc.
1262629088981848066	2020-05-19 06:20:07+00:00	To many people are unable to get the covid payment due to anomalies, people working in the gig economy and the arts, people over 66 who have been working and people under 18 who were working are all missing out, these anomalies need to be fixed straight away. https://t.co/cTVHkVWe96
1262447925801766915	2020-05-18 18:20:15+00:00	There should be no return to a 2 tier health service. Join the Campaign for an All Ireland National Health Service launch meeting tomorrow 7pm over on facebook live https://t.co/2gGEkoqsTj
1261344411864055808	2020-05-15 17:15:17+00:00	In Blackrock today supporting Debenhams workers who have been treated awfully by the company.  Their fight is crucial for their rights and for all workers during and after this crisis.  I have raised this in the Dail and will continue to raise it at every opportunity https://t.co/9ztFeHY4Xp
1261315215670390785	2020-05-15 15:19:16+00:00	The importance of arts during this pandemic has not been reflected in the government supports https://t.co/TD7GKSBorF
1261272063202996224	2020-05-15 12:27:47+00:00	@VickyWrites @NWCI @Paschald Hi vicky, can you dm me your number and I'll give you a call
1261224439649312770	2020-05-15 09:18:33+00:00	@NewstalkFM @PatKennyNT @MurphyEoghan dormitory style shared accommodation for homeless must end immediately after #COVIDー19 . Everyone needs own door accommodation from now on. Btw only 27 council houses completed in @dlrcc last year with 5000 on list
1261223199943032832	2020-05-15 09:13:37+00:00	@NewstalkFM @MurphyEoghan co-living development in Dun Laoghaire, 200 box-rooms, site is beng cleared. After #COVID19 such box developments must stop. Empty properties being sat on by speculators, absentee landlords &amp; vulture funds must be taken by govt for public use. @pb4p
1261222526845251584	2020-05-15 09:10:57+00:00	https://t.co/ipEoWPQsxe https://t.co/dIpV8QtVk7
1260958677206532099	2020-05-14 15:42:30+00:00	I requested #dail debate on the plight of arts workers, who face major crisis in Covid19. Debate will start at 7pm. I am scheduled to speak at c. 8.10pm.  Will call for major investment to support the arts and arts workers through crisis. @Campaign4Arts @AideenHoward
1260940648816930821	2020-05-14 14:30:52+00:00	Working people must not be forced to pay the price of this pandemic. https://t.co/w55dHhSNkR
1260920839102443520	2020-05-14 13:12:09+00:00	Have written to @LeoVaradkar this morning insisting that there is a party leaders briefing with health officials before phase 1 of the lifting of restrictions on May 18 particularly because of major health and safety concerns across workplaces.@RTENewsPaulC @fiachkelly @SeanDefoe
1260645965674901505	2020-05-13 18:59:54+00:00	The government needs to bring in a range of supports to ensure taxi drivers can continue to pay their insurance, mortgages, rent etc for the duration of the crisis. also screens and sanitiser needs to be provided by the state to ensure safety of drivers and passengers. https://t.co/dqFILgcw9b
1260619244770938882	2020-05-13 17:13:43+00:00	This runs contrary to health advice to wash hands. Lucky we defeated water charges or people might be reluctant to wash hands. We need to invest in water infrastructure not cut back on essential hygiene. People urged to conserve water amid Covid-19 demand https://t.co/0Ybr49lU1F
1260594481138733056	2020-05-13 15:35:19+00:00	Asked Minister Ross about providing special packages for taxi drivers whose livelihoods have been devastated by the pandemic with 97% of them not able to operate at the moment.  He promises to get back to me in writing.  We'll see!
1260593939943391233	2020-05-13 15:33:10+00:00	Speaking in the #Dáil shortly about the return to work for bus eireann workers who will see a big increase in passengers next week and they just do not have the protocols in place to ensure passengers and drivers are safe.  Lets see what Minister Ross has to say
1260566771607666693	2020-05-13 13:45:13+00:00	The Debenhams workers fight is a fight for every worker, soon thousands of workers could be in similar situations. we need government intervention to save these jobs and to stop these companies treating loyal workers with such disrespect. https://t.co/1uljpYioMb
1260250952231256064	2020-05-12 16:50:15+00:00	In support of #IND2020, @pb4p are calling on the government to accept and implement the demands of @INMO_IRL Nurses need safe staff levels, pay parity, more student nurse places and should all be given the pay increase which they won. #Couragetocare #avoicetolead https://t.co/5wRdd4fVwO
1260105956429565954	2020-05-12 07:14:06+00:00	@morningireland Some large non-essential construction sites have been working for weeks,totally flouting “road map” timeline-there’s no enforcement. Also, I got no report back from Min Harris after reporting allegations of widespread Covid symptoms in Cavan beef plant 10 days ago
1258731040555892737	2020-05-08 12:10:40+00:00	Briefing for parties will be internal but Joe Mc Hugh most likely will do press briefing also. @Ginosocialist going on behalf of @pb4p
1258729475946221568	2020-05-08 12:04:27+00:00	Short notice Ed briefing with Min Joe Mc Hugh at 1.15, obvs on #LeavingCert2020. @pb4p will attend &amp; urge gov to #canceltheleavingcert as we said for weeks &amp; certify based on assessment &amp; open up 3rd level courses based on choice @emma_okelly @SeanDefoe @IrishMirror @IrishTimes
1258475174439108608	2020-05-07 19:13:57+00:00	Talking in Dáil earlier about the importance of a single tier national health service https://t.co/sIuqXGvO3j
1258364345123209216	2020-05-07 11:53:33+00:00	This morning we launched a petitiont to keep the Covid €350 payment until the end of the crisis.  We also want it extended to those who lost their incomes due to #COVID19 including those who work in the gig economy and those over 66 or under 18 who were working before the crisis https://t.co/EqsWdKyAhM
1258337337085513728	2020-05-07 10:06:14+00:00	I Proposed successfully at #Dail business ctte today that plight of workers, performers in Arts, Music Film, etc be debated in Dail next week. Arts workers have been decimated, many not getting #COVID19 payment &amp; face very uncertain future. @Campaign4Arts @TheatreForumIE @pb4p
1257742613450575873	2020-05-05 18:43:01+00:00	https://t.co/JdbTICsv5J
1256665024094973953	2020-05-02 19:21:04+00:00	@olivercallan Keep up the good work @olivercallan. Oliver has satirised everyone on the left, right &amp; centre of politics - comedy and satire are essential to a free and democratic culture. Ever heard of Jonathan Swift?!! The FG bots and thought police should get back in their box.
1256653174859010052	2020-05-02 18:33:59+00:00	This is a total disgrace! We need a massive &amp; PERMANENT increase in health staffing &amp; the HSE will “use” them when they need them on agency contracts!!This is how we treat our heroes!! https://t.co/nJIRgUYVVR
1256613717397123073	2020-05-02 15:57:11+00:00	Asked @LeoVaradkar in #Dail on Thurs why health workers who answer the “call for Ireland” are given worst possible temporary agency contracts with no sick pay. This is how FG reward health workers! Hire em &amp; fire em contracts to make profits for a private agency @pb4p #COVID__19 https://t.co/9KdDtqzrVx
1256584312612433920	2020-05-02 14:00:20+00:00	We've been saying for weeks, gov should cancel the lc, its unfair to put lc students through the stress of sitting this exam. students may have health conditions or find it difficult to study during lockdown, the gov could certify students to allow them carry on with their lives. https://t.co/ECBCTjyKhT
1256573301708783618	2020-05-02 13:16:35+00:00	I asked Tony Holohan &amp; @LeoVaradkar at leaders meeting  this week if we’re doing trials of this treatment here. EU started project in April, preliminary results around the world are promising.We should collect plasma from recovered cases &amp; offer to critical cases #COVID__19 https://t.co/uDfOOuHgda
1256329972823678978	2020-05-01 21:09:41+00:00	Dún Laoghaire Rathdown Town Hall lighting up red for May Day, International Workers Day. It does so out of respect for all of our frontline and essential workers #MayDay2020 #WorkersDay https://t.co/ulcPIqNpXU
1256282430891270150	2020-05-01 18:00:46+00:00	Since Feb 20th we have been asking question on the advice on which the government is basing decisions during the #coronavirus crisis.   we have still not received any answers https://t.co/J3esnAASel
1256268409093918721	2020-05-01 17:05:03+00:00	Our health service needs permanent staff not these temporary contracts which are being offered to the brave people who have stepped up to work in our health service through #oncallforireland https://t.co/ENsVI7wjPb
1256163303694499841	2020-05-01 10:07:24+00:00	This May Day Make The Commitment: Get Organised! join a union! #mayday #mayday2020 #may1st #workersday #joinaunion #organise https://t.co/mQXGDf5e5V
1255905012070350860	2020-04-30 17:01:03+00:00	This Friday at 6pm.  Make 5 minutes of noise for frontline workers, and for:  ➡️15euro living wage  ➡️Trade union recognition  ↘️Decent working conditions https://t.co/OSS9u9V15W
1255858245878644736	2020-04-30 13:55:13+00:00	This Friday at 6pm.  Make 5 minutes of noise for frontline workers, and for:  ➡️15euro living wage  ➡️Trade union recognition  ↘️Decent working conditions https://t.co/8UxsaUwnL1
1255814319612342275	2020-04-30 11:00:40+00:00	This Friday at 6pm.  Make 5 minutes of noise for frontline workers, and for:  ➡️15euro living wage  ➡️Trade union recognition  ↘️Decent working conditions https://t.co/frBTGzBwhx
1255765110800482306	2020-04-30 07:45:08+00:00	📢 May Day 2020  People Before Profit is supporting the call from the Derry Trades Union Council for 5 minutes of noise at 6pm on May Day - Friday 1st May - In solidarity with our frontline workers.  Get involved, demand protection and reward for our frontline! Solidarity 🚩 https://t.co/64SY9EeqNc
1255554968452554754	2020-04-29 17:50:06+00:00	📢 May Day 2020  People Before Profit is supporting the call from the Derry Trades Union Council for 5 minutes of noise at 6pm on May Day - Friday 1st May - In solidarity with our frontline workers.  Get involved, demand protection and reward for our frontline! Solidarity 🚩 https://t.co/kWfP8SWzE4
1255543671698739202	2020-04-29 17:05:12+00:00	#MayDay2020  📺 Tune in to our LIVE Public Meeting this evening at 7:30pm - Defend workers' rights: Get organised!   link to meeting below ⬇️  https://t.co/iL3Tzqg8gv https://t.co/DPDxMzv1Np
1255497228300488712	2020-04-29 14:00:39+00:00	Shared from DLRCOCO:  Do you have a local initiative the could benefit your community in the area of #arts #events #business #ourcommunity  #CommunitySpirit #BrightIdea  Apply now: https://t.co/dUgBEGbNyv https://t.co/tBefP2jUtk
1255494077140938752	2020-04-29 13:48:08+00:00	This morning supporting Debenhams workers in Blackrock while @bridsmithTD was standing with them on Henry street. https://t.co/e8QoUzwKy1
1255479604627865601	2020-04-29 12:50:38+00:00	Leaders mtg today: will ask why my requests for Expert Advisory Group minutes &amp; advices &amp; ICU surge capacity modelling refused for 2 mths? What plans for permanent increases in ICU, testing &amp;tracing capacity?Will they now cancel #LeavingCert? Is there all-Ireland exit plan?@pb4p
1255472779593494528	2020-04-29 12:23:30+00:00	Attending #DebenhamsWorkersRally online. Great show of support hundreds joining rally, hundreds more watching on FB. Fair play to all the workers for standing up to this rotten treatment by @Debenhams. All workers should support them, it could be any one of us. @MandateTU @pb4p
1255469540626116613	2020-04-29 12:10:38+00:00	#DebenhamsWorkersRally @siobhwithafada Just so you know PeopleBefore Profit TDs  are attending aswell. Please add us to your list
1255453046521442307	2020-04-29 11:05:06+00:00	This Friday at 6pm.  Make 5 minutes of noise for frontline workers, and for:  ➡️15euro living wage  ➡️Trade union recognition  ↘️Decent working conditions https://t.co/pTA3XMB2wn
1255446496889262081	2020-04-29 10:39:04+00:00	At @Debenhams in Blackrock this morning. The disgraceful treatment of these workers who gave years of loyal service is unacceptable. Government is a shareholder and must intervene. This is a test case for treatment of all workers. Please support them. @pb4p @MandateTU @SIPTU https://t.co/IjWSbXhqMc
1255406521497911298	2020-04-29 08:00:13+00:00	A communal art project on killiney beach, really nice idea. https://t.co/3yOpBAygT4
1255268238625255425	2020-04-28 22:50:44+00:00	@AllyouneedisC @johnjoechad @SimonHarrisTD @RTENewsPaulC @rtenews @gavreilly https://t.co/im7o4fC93w
1255267937050599424	2020-04-28 22:49:32+00:00	@MiriamODonoghu @SimonHarrisTD @RTENewsPaulC @rtenews @gavreilly Suppose some out there should still think you say nothing when you receive a report about a threat to people’s health, but here’s some other people who thought they should speak out. https://t.co/5gtyMhPbZT
1255172428457750528	2020-04-28 16:30:01+00:00	Although our office remains closed due to the health crisis, we are here for any advice or assistance you may need, you can contact us online on our social media accounts or by email/phone as bellow:  Richard.BoydBarrett@oireachtas.ie (01) 230 3020 https://t.co/DF4uF8byv8
1255090250231296000	2020-04-28 11:03:28+00:00	@BillEbrill @IRISHM1CHA3L @SimonHarrisTD @RTENewsPaulC @rtenews @gavreilly Seriously Bill, you’re trolling. I get email from someone who says he is very scared worker in this factory &amp; you want me to do nothing? I deliberately didnt mention name of factory &amp; added I couldn’t confirm but asked minister to investigate. It’s only responsible thing to do!!
1255084901185052674	2020-04-28 10:42:13+00:00	@BillEbrill @SimonHarrisTD @RTENewsPaulC @rtenews @gavreilly Seriously, what do you expect me to do when I get a report like this except write to Minister and ask for investigation? You think I should say and do nothing? That would be very responsible when People’s health is at risk!!
1255056195729215489	2020-04-28 08:48:09+00:00	Just got disturbing email from worker in Cavan factory claiming up to 160 workers #Covid_19 symptomatic,boss threatening workers not to report or they’ll lose their job. Can’t verify story but wrote to @SimonHarrisTD seeking urgent investigation @RTENewsPaulC @rtenews @gavreilly
1255029057768620032	2020-04-28 07:00:19+00:00	The developers behind the co-living development on Eblana av are about to appoint a construction company to the project, that this development was given planning permission at all is a disgrace but in light of the COVID-19 crisis, co-living would be a public health disaster. https://t.co/dplRBQYYa5
1254998870108639232	2020-04-28 05:00:22+00:00	Today is Workers Memorial Day -  A time when trade unionists all over the world remember workers killed, injured or made ill at work.  We're encouraging everyone to participate in a minute of silence at 11am today to pay tribute to workers killed by the Covid-19. https://t.co/7ooS4lOvbM
1254834009777061890	2020-04-27 18:05:16+00:00	Although our office remains closed due to the health crisis, we are here for any advice or assistance you may need, you can contact us online on our social media accounts or by email/phone at the numbers below. Richard Boyd Barrett: Richard.BoydBarrett@oireachtas.ie (01) 230 3020 https://t.co/5Frl54Zxpm
1253723051935641602	2020-04-24 16:30:43+00:00	In 6 weeks we still haven't received answers to vitally important questions, this is completely unacceptable, we need much more transparency from the government. #COVID19 #CoronavirusIreland https://t.co/IZhK5764Ne
1253319042246434817	2020-04-23 13:45:19+00:00	@Paschald says road to post #COVID19 Ireland must be dictated by public health, will be asking him if he accepts that means huge investment to increase capacity and staffing in our health service and an end to two tier health. We need to double icu capacity, pay health workers
1252697893397565442	2020-04-21 20:37:06+00:00	A completely unfair and bizarre decision: Govt has just said no mass gatherings til end of August but plans to hold leaving cert (a mass gathering!) in July and put school students through stress &amp; pressure of late exam in the time #COVIDー19. #LeavingCert2020 should be cancelled https://t.co/aUWV0Yy2Jz
1252597678380396544	2020-04-21 13:58:53+00:00	Attending #dail business cttee today at 4pm.Asked last week for debates on transition to post #COVIDー19 &amp; Education(leaving cert), with health &amp;leaders q’s. Will also protest failure of Health Minister to answer most of written q’s submitted weeks ago. Only 8 of 56 Q’s answered.
1252597336871755776	2020-04-21 13:57:31+00:00	"People Before Profit's Richard Boyd Barrett said it (the glass bottle site) should be kept in State possession.  He said: ""The only guaranteed way to develop this site for the affordable and public housing we need is for the State to do it directly.  https://t.co/OHlYjRDdpb"
1252590268710301696	2020-04-21 13:29:26+00:00	Madness now for NAMA to sell-off IGB site to speculators. It was wrong to do it before #COVIDー19 but now with market uncertainty developers can’t be relied upon to deliver the affordable &amp; public housing we need. Sale should be halted &amp; the state should build itself. @pb4p https://t.co/1DTPiu7Jof
1252558663807623169	2020-04-21 11:23:51+00:00	At Debenhams in Blackrock this morning supporting workers who've given many years of loyal service only to be dumped using COVID-19 as an excuse,   spoke with shop steward Jackie Rhodes who has worked for Debenhams for over 20 years.   Debenhams must not be allowed to walk away. https://t.co/PGNIrsycm5
1252545869271924737	2020-04-21 10:33:01+00:00	@Debenhams in Blackrock supporting the workers who’ve given many years of loyal service only to be dumped using #covid as an excuse. @debenhams must not be allowed to walk away. https://t.co/Zs3hSrf7tz
1252227144161378304	2020-04-20 13:26:31+00:00	This resignation by a prominent Doctor &amp; appointee to medical board is a damning indictment of the governments failure to manage the #Covid_19ireland crisis in nursing homes with tragic consequences. The Govt prioritised PR over proper planning and now we see the results https://t.co/g2dfakI8H5
1251217091086225408	2020-04-17 18:32:55+00:00	The job of spearheading the lifting of restrictions was given to a consultant from Ernst and Young who has no medical experience whatsoever https://t.co/uiLiJBDSKY
1251215847068176385	2020-04-17 18:27:59+00:00	Just received letter from intensive care specialists saying Ireland’s ICU capacity critically low at 285 beds when HSE report(2009) said we needed 579-11 years on faced with #Covid_19,nothing done by FG/FF- Utterly disgraceful! @pb4p @rtenews @NewstalkFM @IrishTimes @IrishMirror https://t.co/TIKbPgsWJ8
1251151367109922818	2020-04-17 14:11:45+00:00	Private patents and profiteering are impeding our response to #COVID19ireland crisis https://t.co/pgDTwnZ3FT
1251139933172985856	2020-04-17 13:26:19+00:00	@forgotthesnot @pb4p @pb4p writing today to both Minister for Health and Minister for social protection calling for them to send in HSA and WRC inspectors to investigate if public health, health and safety regulations and employment rights are being adhered by #keelings.
1251133079504199680	2020-04-17 12:59:05+00:00	The problem is not the workers coming in, it’s that essential workers are having their health &amp; safety compromised by #keelings &amp; are being exploited. We should stand with these workers &amp; demand the HSA &amp; WRC are sent in to protect their health &amp; rights as employees @pb4p
1251061330297196544	2020-04-17 08:13:59+00:00	@SimonHarrisTD said on @rtenews this morning, public health would dictate lifting of #COVID19 restrictions. Strange then, as I pointed out in #Dail yesterday that HSE appointed a consultant with no medical expertise from accountancy firm Ernst &amp; Young to this job last week. Why?
1250864286701944840	2020-04-16 19:11:00+00:00	Huge support in ballybrack for front line workers https://t.co/FR9vLKo5lO
1250850557713145857	2020-04-16 18:16:27+00:00	@coso77 @JoeNannery @DanielRCarson to be updated in light of the new situation. We are pressing hard for this to happen.
1250850506731327489	2020-04-16 18:16:15+00:00	@coso77 @JoeNannery @DanielRCarson prior to lockdown sf/pbp and some left indos were close to finalising a doc. Over last weeks our focus has been responding to crisis. But we have now contacted sf in last few days and suggested that parties of the left need to put an alternative left prog for gov forward.this has
1250824197737263104	2020-04-16 16:31:42+00:00	We have heard all of FF and FG's promises before, no return to their failed policies. https://t.co/IMtJAsMAHx
1250793141805989890	2020-04-16 14:28:18+00:00	"People Before Profit TD Richard Boyd Barrett has said we must get away from the ""failed policies"" of Fine Gael and Fianna Fáil in areas like health, housing and other essential services. https://t.co/ejMcjSHO7X"
1250766384226865152	2020-04-16 12:41:58+00:00	Questioning Taoiseach in #Dáil shortly. Will ask how FG/FF think they should return to power when their policies of austerity and privatisation savaged staffing and capacity in our health service to dangerously low level before #COVID19 @pb4p @d_okeeffe https://t.co/IA2UFGIT3G
1250456668875493380	2020-04-15 16:11:16+00:00	@TomClonan @SimonHarrisTD @TomClonan. Totally understand your concerns and will write to @SimonHarrisTD and ask him to include a section that reiterates the inalienable rights of people with disabilities. Pretty shocking that this has been left out.
1249054203491876864	2020-04-11 19:18:23+00:00	@phonsiefonz for 9 years since we got into Dail, @pb4p argued to reverse FF/FG staffing &amp; budget cuts &amp;establish a fully public health service-WHO says staff is critical to respond to #COVID19. Our ICU capacity-one of lowest in EU &amp; profiteering on back of the crisis is rampant- say nothing?
1248573457245356037	2020-04-10 11:28:04+00:00	SNAs make education possible for kids w/additional needs.Confusion over redeployment is upsetting many; we value your vital work &amp; want you facilitated to work with children you’re linked with.  @kidsbehindthec1 @andypike @forsa_union_ie @SNAsSpeakOut #Respect4SNAs
1248514683788812288	2020-04-10 07:34:31+00:00	we’d like to hear from you.  We set up a helpline to help support workers during the #COVID2019 crisis. It has come to our attention that some employers appear to be abusing their powers. https://t.co/aL5PWcNVTA
1248307048242188289	2020-04-09 17:49:27+00:00	I went into the leaders meeting today and raised these issues, still no clear answers on why they weren't better prepared for this crisis #COVIDー19 #COVID19 https://t.co/EN00e03lcA
1248289625849966594	2020-04-09 16:40:13+00:00	leaders briefing: Paul Reid HSE admitted disgraceful fact that “proprietorial issues”hampering getting testing to needed level ie companies chasing profit! not clear if #COVID19ireland curve will stay below ICU capacity.Privatised nursing home sector also clearly a problem @pb4p
1248232912744579072	2020-04-09 12:54:52+00:00	Attending leaders briefing today with Taoiseach, Min Harris, CMO &amp;HSE on #COVID19ireland -alarm bells ringing on our low ICU capacity, fast rising disease clusters in nursing homes (what are the plans?)&amp; private interests profiting from crisis at workers &amp; public’s expense @pb4p
1247863536132513793	2020-04-08 12:27:05+00:00	Will be raising this important point from ⁦@WHO⁩ chief ⁦@DrMikeRyan re overcrowded housing conditions and #COVID19 transmissionat #dail briefing with Dept of Housing today. ⁦@pb4p⁩ very worried about overcrowding in homes, hubs and hostels.  https://t.co/Dx5120ThbO
1247836178499473410	2020-04-08 10:38:23+00:00	Excellent article by @bridsmithTD about why we need public control of our health service and the private production capacity that is producing essential goods for the crisis https://t.co/1PjTSpZO8U
