id	created_at	full_text
1247229755235151874	2020-04-06 18:28:40+00:00	@mcgrl @SimonHarrisTD @Paschald Yes, I suggested zoom meetings 2 weeks ago but govt did nothing about it. They just don’t want to answer questions on PPE, testing, nursing homes, income supports etc Funny though, they are working on a bigger venue for election of Taoiseach - they can do it when it suits them
1247165234919305217	2020-04-06 14:12:17+00:00	FG, FF &amp; others refused our request that #Dail sit this week for Q&amp;A with #Taoiseach, @SimonHarrisTD &amp; other Mins. Won’t answer Q’s til 16th. No explanation why we must wait 10 days for urgent questions. Also asked that @Paschald answer q’s re: wage subsidy,income &amp;other issues.
1247146970210336768	2020-04-06 12:59:43+00:00	Attending #dail business ctte meeting now at 2pm. Will argue Dail should meet this week to allow Q &amp; A with key Ministers on #Covid_19 crisis-many questions on PPE, private consultants, testing, ICU , wage subsidy, nursing homes need answers @RTENewsPaulC @NewstalkFM @PatLeahyIT
1246405614802219009	2020-04-04 11:53:50+00:00	People in homeless hubs, hostels, or in overcrowded family conditions- cannot self- isolate.  We must urgently address this. #COVID2019 #coronavirus #homesnothostels https://t.co/zHEiGFOhAH
1245823325349335040	2020-04-02 21:20:01+00:00	Democracy is not an optional extra, it is absolutely vital that the Dail continues to function throughout the current crisis #COVID19Pandemic #coronavirus #COVID19 #democracy https://t.co/pRadaeYS07
1245820403223846912	2020-04-02 21:08:25+00:00	"""With a large number of TDs in agreement, he led the change against cancelling Thursday’s Dáil sitting. It went ahead and their subsequent arguments against suspending parliament came across as non-confrontational, non-political and reasonable."" https://t.co/U9KIdVb9Dd"
1245685976489476098	2020-04-02 12:14:15+00:00	It is vital that the Dáil continues to meet during this #COVID19Pandemic to ensure that democracy continues to function and that there is an opportunity for opposition TD’s to raise the many concerns of the public and to hold the gov to account.  #coronavirus #covidireland https://t.co/F1hRhGCEHa
1245478306348220416	2020-04-01 22:29:02+00:00	@CharlieFlanagan comments kinda unbelievable -we’re in the height of an unprecedented health emergency &amp; the #dail is due to discuss #COVIDー19 &amp; health &amp; social welfare. TD’s inundated with questions, concerns &amp; fears from the public &amp; the government doesn’t want to hear them! https://t.co/DpkPQ8s7c4
1245380024280195074	2020-04-01 15:58:30+00:00	Going to Gov briefing on Education &amp; #Coronavirusireland now. Will raise concerns about students in EFL schools. Hundreds of students that paid huge fees, no classes, no refunds &amp; without money, many living in overcrowded unsafe conditions @emma_okelly @KittyHollandIT @pb4p
1245361250881634304	2020-04-01 14:43:54+00:00	On 98fm this morning to discuss Dublin bus workers being forced to use their holiday days during the crisis. since posting my original status it has become clear that many workers are finding themselves in a similar position (full clip on my Facebook page) https://t.co/4Ab5K1dbwR
1245099856349278221	2020-03-31 21:25:13+00:00	Dublin Bus just told bus workers they must take 10 days of annual leave (a day a week) during #COVID19ireland crisis-stealing half their annual holidays. These essential workers risk their health &amp; this is the thanks they get! It’s shameful! @pb4p @morningireland @NewstalkFM
1244971541248520192	2020-03-31 12:55:20+00:00	One of the lessons from this crisis is that a single-tier health service is absolutely essential, when this crisis is over we need to ensure there is no going back to a 2 tier model  #COVID19ireland #coronavirus https://t.co/Gv1xNq7Tm7
1244953161997135874	2020-03-31 11:42:18+00:00	Our objection to Gov efforts to suspend #Dail successful! Just got call that suspension plan withdrawn. With Gov making big decisions to pay private hospitals large sums instead of absorbing into public system&amp;many public questions-democracy must continue @pb4p #COVID2019IRELAND
1244690339044220932	2020-03-30 18:17:56+00:00	Far-right Hungarian PM Orban using #Covid_19 to silence opposition &amp; media &amp; rule by decree. Meanwhile ⁦@FineGael⁩, sister party of Orban’s, trying to suspend Dail &amp; opposition being silenced on major public issues &amp; questions here ⁦@pb4p⁩  https://t.co/D4WvHvzZ8J
1244679175094644737	2020-03-30 17:33:35+00:00	@The_TinyDonkey @bridsmithTD I’m happy to do remotely but seems there are constitutional issues. With TD’s receiving huge numbers of queries, expressing fears &amp; raising issues, it’s vital democracy continues &amp; these questions are put to Govt. Unilateral suspension of democracy by caretaker gov is not on.
1244667630402838528	2020-03-30 16:47:42+00:00	The government are trying to suspend Thursday’s Dail session, this can't be allowed to happen, democracy absolutely must continue throughout the current crisis and this “caretaker” government must be answerable to the people. #Covid_19 #coronavirus https://t.co/aAVcxdcjmH
1244656665921798146	2020-03-30 16:04:08+00:00	Clear lesson from #Covid_19 emergency is-you can’t have two tier health service if you want to protect people-yet @LeoVaradkar on @drivetimerte at pains to say public control of private healthcare is only “temporary”. This is not acceptable, we must have a one tier health service
1244644588830195716	2020-03-30 15:16:09+00:00	Gov want to cancel #Dáil sitting on Thurs, where vital issues on the #Covid_19 emergency &amp; social prot due to be discussed. As member of #Dáil bus cttee I am opposing this. Many concerns from public need answers &amp; discussion. Caretaker gov  must be held accountable. @rtenews
1244634115820924931	2020-03-30 14:34:32+00:00	Wrote to @SimonHarrisTD today re volunteer charity, Irish Community Rapid Response, who provide backup helicopter to Ambulance service. Will cease to operate on Fri if they don’t get funds. Vital service, more vital with #Covid_19. Gov must step in. @rtenews @NewstalkFM
1244404123585449986	2020-03-29 23:20:37+00:00	Good if true Danny but it’s just not. Tony Holohan told me himself we need to get to 15,000 tests a day (currently we’re at 5000 &amp; last week we were at 2,500)to be at South Korea levels &amp; we need antibody &amp; rapid antigen testing which were not doing. But we could do it if we act! https://t.co/ZM9em1k2z1
1244401735134842888	2020-03-29 23:11:08+00:00	Quite right Michelle,but alongside vital social distancing, we need testing. According to WHO: “test, test, test” to track virus &amp; target measures. Also, you need ICU &amp; staff capacity with the equipment needed to prevent crisis becoming a catastrophe-we must build capacity now! https://t.co/M4hPvnHD9M
1244399143663140871	2020-03-29 23:00:50+00:00	why we need to urgently utilise &amp; take under public control all private capacity that exists here to produce PPE. We need a secure adequate supply - same can be said of lab capacity for testing &amp; capacity for producing ventilators. https://t.co/kYTp6l3MZt
1244391347886440451	2020-03-29 22:29:51+00:00	@Sandyc101 @rfwalsh86 Sandy,solutions:1 increase testing to required levels by taking-over public &amp; private labs now used for other purposes 2. Reply to manufacturers who can make badly neededPPE 3. Support &amp; house EFL students &amp; homeless in unsafe,overcrowded conditions in empty apartments &amp; hotels.
1244373317970165760	2020-03-29 21:18:12+00:00	@rfwalsh86 @Sandyc101 Appreciated Robert. Talked today to scientist, worried at low level of #Covid_19 testing &amp; explained how state tests 5 million cattle a year for TB &amp; that Teagasc &amp; Dept of Ag labs have capacity to do this for Covid. A little depressing Sandy thinks I should say nothing of this.
1244359031722053632	2020-03-29 20:21:26+00:00	@Sandyc101 Sandy, contacted Taoiseach’s office to inform him of manufacturer who can make PPE but got no reply from Simon Harris. Talked to EFL teachers worried students in dormitories of 4-6 refused Covid payment. Answered multiple queries from worried people and more.Should I say nothing?
1244321187729149954	2020-03-29 17:51:04+00:00	Good some badly needed PPE finally arriving for our health workers but we must urgently requisition private manufacturing capacity to produce secure supply of PPE &amp; Ventilators here, &amp; take-over private &amp; public labs that could be used for testing. Testing level is far too low. https://t.co/AFHJArA3Gs
1243652887974219776	2020-03-27 21:35:29+00:00	Finally, they close non-essential work! 2km restriction meaningless. Real issue is ICU capacity, bed/isolation capacity, PPE for health workers, testing &amp; accommodation for those in overcrowded/vulnerable conditions. PR overtaking public health  @pb4p @rtenews @MichealLehane
1243634991042629632	2020-03-27 20:24:22+00:00	Hope Gov now have plan for ICU capacity that I asked DOH for in Feb but got no reply or plans to requisition empty apartments &amp; hotels for mild #COVID19 cases who should be discharged from hospital but have nowhere to self-isolate or those in hubs, direct provision  &amp; overcrowded https://t.co/TDApjY1ZTI
1243632370751766529	2020-03-27 20:13:57+00:00	In the fight against Covid-19 many student health workers have been drafted in by the HSE and have answered the call heroically.   We need to ensure that all students helping in the fight against Covid-19 are paid fairly and equallly  #coronavirus https://t.co/6uTqVpmtWB
1243574018135011332	2020-03-27 16:22:05+00:00	This is scary but not surprising given cuts &amp; under-resourcing of health service by FG/FF for 2 decades. I wrote to DOH in Feb asking their plan for ICU &amp; #COVID19 if numbers surged. No response. Have they got a plan?  @GeorgeLeeRTE @FergalBowers @pb4p @harrymcgee @RTENewsPaulC https://t.co/75u6dN6z0H
1243299372626051077	2020-03-26 22:10:44+00:00	@RTE_PrimeTime this economic discussion on a public health emergency is shocking and depressing
1243298503205552128	2020-03-26 22:07:17+00:00	@RTE_PrimeTime OMG! The cold heartless economic drivel coming out from this discussion is truly depressing!
1243288037720719362	2020-03-26 21:25:42+00:00	Well done to @bridsmithTD for proposing the #dail stand to applause health &amp; frontline workers who put themselves on the line to protect us all. Let’s hope we always remember how important these people are in our society &amp; support, resource &amp; reward them. @pb4p #clapforourcarers https://t.co/C1czQkGKdq
1243278706560446465	2020-03-26 20:48:37+00:00	Well done @bridsmithTD https://t.co/7zD8tj5Mw3
1243270360583286784	2020-03-26 20:15:27+00:00	Amazing to see so many out in our area to support our healthworkers, I hope when this is all over we will continue to recognise just how important these people are who have been risking health to keep us going. This video sent to me from Ballybrack. #COVID2019 #clapforourcarers https://t.co/1AoEdn2rWD
1243266213049962497	2020-03-26 19:58:58+00:00	I hope we learn for ever the importance of these people who have often been under paid and under valued In our society. https://t.co/3JwVkzz1yv
1243221715817283587	2020-03-26 17:02:09+00:00	Vulnerable populations like those in emergency accommodation are at serious risk of contracting Covid-19. We should also not leave pensioners or those with disabilities on the €203 payment.  Protect the vulnerable now! #COVID2019 https://t.co/ir6ReRvqCN
1243134078158884864	2020-03-26 11:13:55+00:00	Great suggestion from @bridsmithTD https://t.co/GwDvtPDG3T
1243106263388561408	2020-03-26 09:23:23+00:00	Going in to #Dáil Business Committee now. Discussing today’s sitting and that the Dáil needs to continue to meet during #COVID2019 crisis, albeit in smaller numbers to ensure #PhysicalDistancing. @rtenews @RTENewsPaulC @irishexaminer
1243092707389714432	2020-03-26 08:29:31+00:00	@MurphyEoghan @morningireland we need a rent amnesty during the #COVID2019 crisis for all those who lose employment or income-freezing increases is simply not enough, on reduced income people won’t have enough for rent. @pb4p have amendments to bring in rent amnesty today.
1242897911471640577	2020-03-25 19:35:28+00:00	PBP calls for reward payment for frontline staff -Health, food retail &amp; supermarket, public transport, waste collection, water services, emergency &amp; other essential workers who are risking themselves to protect us &amp; keep us going should be rewarded  https://t.co/5JyaXTG6H5
1242782561694253056	2020-03-25 11:57:07+00:00	#HSE just confirmed to me that testing backlog will mean people who had #COVID19 will be missed. Lab capacity also a factor in delays. This is why issue of taking relevant private industrial and lab capacity into public control is key. @pb4p @rtenews @newstalk @IrishTimes
1242759148166676480	2020-03-25 10:24:04+00:00	Going to HSE briefing now to raise concerns, brought to us by medics and scientists of the serious consequences of testing delays &amp; from building workers about physicaal distancing on their &amp; most sites. @rtenews @FergalBowers @newstalk #COVID19 #PhysicalDistance #hse
1242564128243429377	2020-03-24 21:29:08+00:00	Getting worrying reports from building workers, saying #PhysicalDistancing impossible on their sites &amp; they should be closed as non-essential. Told of site with 600 workers, few toilets, little hand sanitiser, large numbers in enclosed spaces @morningireland @NewstalkFM @pb4p
1242522685277704193	2020-03-24 18:44:27+00:00	As well as measures announced, government must institute rent, mortgage &amp; utility bill amnesty for all suffering income or employment loss. Even higher payments with incomes reduced will not cover high rents, mortgages &amp; bills.Also need more action on overcrowding @pb4p #COVID19 https://t.co/cvlBfEKdwm
1242509686961844229	2020-03-24 17:52:48+00:00	As well as measures announced, government must institute rent, mortgage &amp; utility bill amnesty for all suffering income or employment loss. Even higher payments with incomes reduced will not cover high rents, mortgages &amp; bills.Also need more action on overcrowding @pb4p #COVID19
1242488486051094528	2020-03-24 16:28:34+00:00	@LeoVaradkar has conceded many things @pb4p said last week, need for much higher income support than €203, taking private health under public control &amp; non-essential closures, but issue of rent &amp; mortgage holiday for those on reduced income still needed @RTENewsPaulC @rtenews
1242403853481410560	2020-03-24 10:52:16+00:00	This morning wrote to @MurphyEoghan asking he help those living in overcrowded conditions in homeless hubs, direct provision, living with parents/grandparents because of #HousingCrisis who can’t do #PhysicalDistancing. Empty apartments,hotels, must be used @pb4p #Covid_19ireland
