id	created_at	full_text
1443520342945902595	2021-09-30 10:17:23+00:00	Climate Action is Community Action. Marianne, Chair of the Co-op Committee at Kilcronan Court, walked us through the retrofit of 40 houses and a community centre as we announce this year’s recipients of the Community Energy Grant Scheme. 🔗https://t.co/DawUpCL4J6 @SEAI_ie https://t.co/5cVRQtC6OV
1442756978875437058	2021-09-28 07:44:03+00:00	Our land use is a carbon source, not a carbon sink.  By working with nature, farmers and researchers are showing how we can deliver a radical turnaround--with benefits for biodiversity, animal welfare, soil health, and water quality.  #mixedsward https://t.co/73b8GROpGu
1442547790836424707	2021-09-27 17:52:49+00:00	The work of @GeolSurvIE helps us understand our natural history and the scale and significance of climate change. Mapping the seabed is also an important step in the development of offshore wind. I encourage all to visit the fascinating exhibition at @NMIreland https://t.co/r5iaPhe5TG
1442056555940257792	2021-09-26 09:20:49+00:00	Delighted to mark the opening of Pelletstown station, the first of many new improvements we are funding on the Maynooth and M3 Parkway line. This new station will greatly benefit the communities of Ashington and Royal Canal Park by providing much-needed public transport options. https://t.co/qLGJVpz7nr
1441415076649525249	2021-09-24 14:51:49+00:00	I was happy to speak with Saoirse Exton from Limerick and other students protesting at #FridaysforFuture The challenge we face is beyond compare and it will take collective effort to reach our targets. https://t.co/fjvQHIM6bY
1441108983763267585	2021-09-23 18:35:30+00:00	I’d a good long conversation with @MLiebreich former founder of @BloombergNEF. We went from talking about the digital, clean energy &amp; transport revolutions needed to tackle climate change, to thinking about the different political philosophies we bring to this challenge #podcast https://t.co/OJbNeCHqMt
1441056133347565577	2021-09-23 15:05:30+00:00	Parking on footpaths and blocking cycle lanes is an offence and puts people at risk. Tomorrow is #MakeWayDay but the law applies every day. https://t.co/2eakYalyMR
1440958906415595521	2021-09-23 08:39:09+00:00	If we don't protect those at risk of fuel poverty during these extreme price increases, then we risk losing the public in the effort to tackle climate change. My European colleagues are in broad agreement that we can't afford to do that. https://t.co/qciUcsjoxP
1440697866050101249	2021-09-22 15:21:52+00:00	I began the week discussing energy prices on @rtenews and the measures under consideration to tackle fuel poverty, security of supply, and our transition to renewables.  The best answer is to develop our own power supplies. 📻 https://t.co/2pvAZQSTFw https://t.co/67rKUjUP97
1440618733752311810	2021-09-22 10:07:26+00:00	At a ⁦@EUCouncil⁩ meeting of energy ministers today, debating how we can protect our citizens from recent spikes in gas prices. We will introduce immediate measures to tackle fuel poverty, while recognising more renewables and energy efficiency give us the best protection. https://t.co/02Dpr1l9wp
1440610304799375368	2021-09-22 09:33:56+00:00	The development of offshore wind energy in Ireland is critical for meeting our climate targets. I gave an overview of the legislative and regulatory arrangements we are putting in place at the 2021 Offshore Wind Energy Conference https://t.co/iLvsyJ72sE via @YouTube
1438971325708701698	2021-09-17 21:01:13+00:00	@TIITraffic launched a new variable speed system for the M50 today. It will allow them better manage traffic flows &amp; dangerous incidents like the one below. It'll be up and running on an advisory basis for the first few months, before we put in place new laws later this year. https://t.co/9O8NPI5nVr
1438174277359095809	2021-09-15 16:14:02+00:00	Another of the issues we campaigned for in opposition, which we are now delivering on in Government. https://t.co/8eqKRanKWh
1437440233453334531	2021-09-13 15:37:12+00:00	The programme of Dublin Climate Action Week will help us all grasp the challenges and benefits of the move to a low carbon economy.  Love for our local places will help us make the change.  Events, resources and action plans available at: 🔗https://t.co/Gc0nDt0NBZ #DCAW21 https://t.co/xyMlhanAR3
1435907028841545729	2021-09-09 10:04:48+00:00	"I met with @robertburns73 and @Dept_Transport officials to discuss ""trialling to succeed"", supports for e-cargo bikes, and empowering local councillors to become leaders in active travel. These measures will reduce the dominance of the private car for the benefit of our children. https://t.co/MGDj6GxBlF"
1435480142177046535	2021-09-08 05:48:30+00:00	"""Ten years from now, do we want to see Leaving Cert students, from all parts of society, celebrated for their potential to contribute to the positive change our planet so desperately needs?"" #LeavingCert2021 #CAO2021 https://t.co/6T0ksdsGYG"
1435197007484882944	2021-09-07 11:03:25+00:00	I visited Waterford yesterday with Deputy @MarcKC_Green to speak with officials at @WaterfordCounci, @waterfordit and the Port about our Climate Targets and utilising new and existing infrastructure to deliver them. https://t.co/xYNkhgZgrm
1433550837163323431	2021-09-02 22:02:08+00:00	Proud of our Ambassador. https://t.co/ZSUnza0xjU
1433448755223834627	2021-09-02 15:16:30+00:00	https://t.co/4skTM08JCL
