id	created_at	full_text
1133009596577193986	2019-05-27 13:58:32+00:00	So proud of @saoirse_mchugh who has polled 51,000 first preference votes in the Midlands-North-West. #EP2019 She ran a brilliant campaign and deserves real credit for helping create a Green wave of thinking, right across the country in recent weeks. https://t.co/KxPpTDKB7d
1132199819706064896	2019-05-25 08:20:46+00:00	About to go on @RTERadio1 to discuss their exit poll. Our @europeangreens colleagues will be on tenderhooks, wishing we can return three MEPs. We hope to hold the balance of power in the new parliament. Every seat counts. #EP2019 #LE19 #greenwave https://t.co/fUKcHQnaSJ
1132154648243113984	2019-05-25 05:21:17+00:00	@a_thaiscidh @saoirse_mchugh Not counting any chickens yet, but i have my dancing shoes shined and am ready to go.
1132153590074748933	2019-05-25 05:17:04+00:00	@RealEddieHobbs @greenparty_ie Many thanks Eddie.
1132153201355108352	2019-05-25 05:15:32+00:00	@ChristineMilne @GraceOSllvn @globalgreens We have being inspired over the years by our friends across the world in the global greens. I hope our own recent good news story gives them cheer.
1132047816682086401	2019-05-24 22:16:46+00:00	'Complacency' a powerful poem from today's #climatestrike in Dublin. #SchoolStrike4Climate  #ClimateEmergency #FridaysForFuture @GretaThunberg https://t.co/5jj0aXl9pk
1131962652362715138	2019-05-24 16:38:21+00:00	A lot of straight talking at the #climatestrike protest in Dublin today. Politicians need to listen &amp; realise that this is not now about just changing a lightbulb or putting out a recycling bin, it has to involve restructuring our society. #SchoolStrike4Climate #FridaysForFuture https://t.co/DYylN7oI4e
1131936341762220033	2019-05-24 14:53:48+00:00	@MWardjourno @davidhealyv She has the secret of eternal youth.
1131906621523800064	2019-05-24 12:55:43+00:00	Even the introverts are out. #climatestrike #SchoolStrike4Climate #FridaysForFuture #Dublin #ireland https://t.co/FehAQYCsUI
1131905027419906048	2019-05-24 12:49:22+00:00	"""Finally the tables are starting to turn, we are talking about a revolution."" #ClimateStrike #SchoolStrike4Climate #FridaysForFuture @GretaThunberg  #dublin #Ireland #ClimateEmergency https://t.co/23NIPLRc8A"
1131896343784501254	2019-05-24 12:14:52+00:00	I like living in a Republic, where every citizen has the same rights and freedoms under our laws. It's up to the people to decide who their leaders will be. Central to that Republican code is the right to vote.  Please make sure you exercise that power today. Please vote Green #1 https://t.co/AdjLd9zoDq
1131623354123902979	2019-05-23 18:10:06+00:00	Out canvassing in Howth with @davidhealyv and who did we meet but my Aunt Margaret. Unlike any other election in the past, we have a sense across the country that there is a grey vote going green. #le19 #EP2019 #GreenWave #WantGreenVoteGreen https://t.co/kEvc87edmp
1131579915319558144	2019-05-23 15:17:30+00:00	At the @ECOUNESCO Young Environmentalist Awards. 1500 students here to present ideas for how we can better look after nature and ourselves. There has been a sea change in public opinion, thanks to the voice and actions of this next generation  #YEA19 https://t.co/bMtY68FeVN
1131520286900326400	2019-05-23 11:20:33+00:00	.@DanielWhooley is our Ongar candidate. If elected we'll work with every other party, trying to agree a civic charter for the council. We want to plan a green future for each  county, not just divide up the Mayoralty &amp; Committee chairs. #LE19 #WantGreenVoteGreen #rainbowcoalition https://t.co/0g5ulMsJQH
1131451100987645952	2019-05-23 06:45:38+00:00	Thank you Frances. I'm sure most of your colleagues in Seanad Éireann would agree, she has made a fine contribution there over the last three years and would be a great European Parliamentarian. #votegrace1 @GraceOSllvn #WantGreenVoteGreen #EP2019 https://t.co/JHTe7zOFRk
1131337529427419136	2019-05-22 23:14:20+00:00	Green Party’s Saoirse McHugh unexpected ‘star’ of European election debates https://t.co/jW2ycLJlDG via @IrishTimes
1131300725559050241	2019-05-22 20:48:06+00:00	I have had the privilege of working with @CByrneGreen for over 15 years. She is a committed councillor, green and campaigner. Hope all that experience can be returned to @DubCityCouncil. #WantGreenVoteGreen #le19 https://t.co/bvUXApw8X0
1131241935350452224	2019-05-22 16:54:29+00:00	@AnMailleach @LeftLost_Pltcs @saoirse_mchugh Many thanks for the kind offer but I think I am going to hold onto the ticket come what may.
1131189852211486721	2019-05-22 13:27:31+00:00	@DominoHarry @saoirse_mchugh and now 4-1
1131189599366275072	2019-05-22 13:26:31+00:00	@decoy12345 @saoirse_mchugh A big party. #gosaoirse
1131175789523865600	2019-05-22 12:31:39+00:00	@TGlennane @saoirse_mchugh Not a word of a lie. No fake news here. I see she is down to 11-1 now. Still best value in the field. https://t.co/rlJ7ZMAHl3
1131158503454904320	2019-05-22 11:22:57+00:00	I am a terrified &amp; irregular gambler but overcame those fears a few weeks ago when I bet on @saoirse_mchugh winning a seat in #EP2019 at odds of 50-1. I hear those odds are now falling fast &amp; think she has a real chance of winning a seat on Friday. #wantgreenvotegreen #greenwave https://t.co/rt2tHHPvkv
