id	created_at	full_text
1176438869719490561	2019-09-24 10:10:58+00:00	Demand for fossil gas in Europe must decline steeply over next 2 decades, if the EU is to stick to its climate plan. An ongoing over-investment in gas infrastructure means the risk of stranded assets is far bigger than fears about security of supply. https://t.co/vJi0ex7HRz @E3G https://t.co/ybAObl3Nvp
1176436938313740289	2019-09-24 10:03:17+00:00	I welcome @LeoVaradkar decision to stop new Oil exploration licences in our Atlantic waters but it should be extended to all drilling for oil &amp; gas. Gas use has expanded Fourfold since 1990 &amp; is forecast to increase 43% by 2030. This is imcompatible with climate science. @SEAI_ie https://t.co/bq0dc0PQVT
1175063824686309377	2019-09-20 15:07:02+00:00	Here's Ruby who is 9 years old.  If we are brave, we can make history and give her back a secure future.  #ClimateStrike #Fridays4Future #schoolstrike4climate #dublin #ireland @GretaThunberg https://t.co/J8nP8vSkuy
1175008077847977984	2019-09-20 11:25:31+00:00	What do we want - climate action - when do we want it? Now! #ClimateStrike #FridaysForFuture #schoolstrike4climate https://t.co/niZIWNDvKK
1175007324097744896	2019-09-20 11:22:31+00:00	Great gathering in Dublin. Marching for our common home. #FridaysForFuture #schoolstrike4climate #ClimateStrike #dublin #Ireland https://t.co/YeScNkzWTA
